TF,exact_query,retrieval_rank,result_id,relevance_score,title,authors,year,journal,doi,pmcid,other_source_id,source_url,publication_type,abstract_available,full_text_available,full_text_available_method,abstract,snippet,retrieval_timestamp_utc,raw_response_sha256,paperclip_version,paperclip_command
STAT1,STAT1 TCR inhibition,5,PMC11678167,,LPS Disrupts Endometrial Receptivity by Inhibiting STAT1 Phosphorylation in Sheep,"Xing Fan, Jinzi Wei, Yu Guo, Juan Ma, Meiyu Qi, He Huang, Peng Zheng, Wenjie Jiang, Yuchang Yao",2024,International Journal of Molecular Sciences,10.3390/ijms252413673,PMC11678167,39769435,https://www.ncbi.nlm.nih.gov/pmc/articles/PMC11678167/,research-article,True,True,source_heuristic(/papers=full-text),"Uterine infections reduce ruminant reproductive efficiency. Reproductive dysfunction caused by infusion of Gram-negative bacteria is characterized by the failure of embryo implantation and reduced conception rates. Lipopolysaccharide (LPS), a major component of the outer membrane of Gram-negative bacteria, is highly abortogenic. In this study, the effects of LPS infusion on the endometrial receptivity of sheep were studied during three critical periods of embryo implantation. The results showed that LPS infusion on d12, d16, and d20 of pregnancy in vivo interfered with the expression of prostaglandins (PGs) and affected the expression of adhesion-related factors ( ITGB1/3/5, SPP1 ), key implantation genes ( HOXA10 ,  HOXA11  and  LIF ), and progestational elongation genes ( ISG15 ,  RSAD2  and  CXCL10 ) during embryo implantation. In addition, after LPS infusion on d12, d16, and d20, the phosphorylation level of STAT1 significantly decreased and the protein expression level of IRF9 significantly increased on d12, suggesting that LPS infusion in sheep impairs endometrial receptivity through the JAK2/STAT1 pathway. Sheep endometrial epithelial cells were treated with 17 β-estrogen, progesterone, and/or interferon-tau in vitro to mimic the receptivity of the endometrium during early pregnancy for validation. LPS and the p-STAT1 inhibitor fludarabine were both added to the model, which resulted in reduced p-STAT1 protein expression, significant inhibition of PGE2/PGF2α, and significant suppression of the expression of key embryo implantation genes. Collectively, these results indicate that LPS infusion in sheep on d12, d16, and d20 impairs endometrial receptivity through the JAK2/STAT1 pathway, which is responsible for LPS-associated pregnancy failure.",Lipopolysaccharide (LPS) infusion in sheep during critical implantation periods disrupts endometrial receptivity by altering gene expression and inhibiting STAT1 phosphorylation. This impairment of the JAK2/STAT1 pathway contributes to LPS-induced pregnancy failure.,2026-07-20T16:50:17Z,bb7a099f82ab8ad0464b497af27c0a88802c353dd764b672bc7afd07517d8e7f,"paperclip, version 0.6.2","paperclip search -s pmc ""STAT1 TCR inhibition"" -n 10"
STAT1,STAT1 TCR inhibition,6,PMC11046697,,Threonine phosphorylation of STAT1 restricts interferon signaling and promotes innate inflammatory responses,"Hozaifa Metwally, Maha M. Elbrashy, Tatsuhiko Ozawa, Kazuki Okuyama, Jason T. White, Janyerkye Tulye...",2024,Proceedings of the National Academy of Sciences of the United States of America,10.1073/pnas.2402226121,PMC11046697,38621137,https://www.ncbi.nlm.nih.gov/pmc/articles/PMC11046697/,research-article,True,True,source_heuristic(/papers=full-text),"For decades, signal transducers and activators of transcription (STAT) proteins have been central to our understanding of immunity. STAT1, a central signaling mediator for interferons (IFN) and antiviral defense, can alter inflammatory responses, yet the scope and mechanisms remain elusive. Here, we unveil Thr 748  as a conserved IFN-independent phosphorylation switch in Stat1, which restricts IFN signaling and promotes innate inflammatory responses. Together with the canonical tyrosine and serine, our identification of the Thr 748  completes the phosphorylation catalog of the transactivation domain of STAT1 and more generally other STAT proteins. Our study indicates that Stat1 displays a phosphorylation-dependent modular functionality in innate immune responses, which may offer opportunities for better and more specific treatments for inflammatory diseases such as sepsis.",Threonine phosphorylation at residue 748 of STAT1 was identified as a novel regulatory mechanism. This phosphorylation restricts interferon signaling and enhances innate inflammatory responses.,2026-07-20T16:50:17Z,8799f1d08bb53d41bfdcce0f02d5b8eb4380c434efe6af6d3442455fc39d9795,"paperclip, version 0.6.2","paperclip search -s pmc ""STAT1 TCR inhibition"" -n 10"
STAT1,STAT1 TCR inhibition,7,PMC12509220,,PARP7 inhibition stabilizes STAT1/STAT2 and relieves experimental autoimmune encephalomyelitis in mice,"Jiashu Xu, Tao Yu, Zongwei Yue, Xuan Lu, Yandong Zhang, Lei Wang, Samaneh Shabani Åhrling, Michael R...",2025,Cell reports,10.1016/j.celrep.2025.116130,PMC12509220,40811059,https://www.ncbi.nlm.nih.gov/pmc/articles/PMC12509220/,research-article,True,True,source_heuristic(/papers=full-text),"The regulation of type I interferon signaling is crucial for precisely tuning the innate immune response to combat pathogen invasions, fight cancer, and prevent autoimmune diseases. PARP7, a mono-ADP-ribosyltransferase also called TiPARP (tetrachlorodibenzo-p-dioxin [TCDD]-inducible PARP), is reported to inhibit the production of type I interferons. Here, we find that PARP7 suppresses type I interferon signaling instead of interferon production. PARP7 ADP-ribosylates and promotes the ubiquitination of signal transducer and activator of transcription 1 (STAT1) and STAT2, which recruits p62 to promote the degradation of STAT1 and STAT2 through autophagy. By reducing STAT1 and STAT2 levels, PARP7 decreases type I interferon signaling. We further show that the inhibition of PARP7 promotes type I interferon signaling and relieves experimental autoimmune encephalomyelitis (EAE) symptoms in mice. Our findings revealed a molecular mechanism via which PARP7 suppresses type I interferon signaling, offering insights into the immune-modulatory function of PARP7 and suggesting PARP7 inhibition as a potential treatment strategy for multiple sclerosis.","PARP7 was studied for its role in type I interferon signaling. Inhibiting PARP7 stabilizes STAT1/STAT2, enhances interferon signaling, and alleviates autoimmune disease symptoms in mice.",2026-07-20T16:50:17Z,67af4df5b1ec99dc033bde64b1faee6c6dc1fc921ae5ef028dc80d3b56ba13ce,"paperclip, version 0.6.2","paperclip search -s pmc ""STAT1 TCR inhibition"" -n 10"
STAT1,STAT1 TCR inhibition,8,PMC5698428,,TYK2-induced phosphorylation of Y640 suppresses STAT3 transcriptional activity,"Raffaele Mori, Joris Wauman, Laura Icardi, José Van der Heyden, Lode De Cauwer, Frank Peelman, Karol...",2017,Scientific Reports,10.1038/s41598-017-15912-6,PMC5698428,29162862,https://www.ncbi.nlm.nih.gov/pmc/articles/PMC5698428/,research-article,True,True,source_heuristic(/papers=full-text),"STAT3 is a pleiotropic transcription factor involved in homeostatic and host defense processes in the human body. It is activated by numerous cytokines and growth factors and generates a series of cellular effects. Of the STAT-mediated signal transduction pathways, STAT3 transcriptional control is best understood. Jak kinase dependent activation of STAT3 relies on Y705 phosphorylation triggering a conformational switch that is stabilized by intermolecular interactions between SH2 domains and the pY705 motif. We here show that a second tyrosine phosphorylation within the SH2 domain at position Y640, induced by Tyk2, negatively controls STAT3 activity. The Y640F mutation leads to stabilization of activated STAT3 homodimers, accelerated nuclear translocation and superior transcriptional activity following IL-6 and LIF stimulation. Moreover, it unlocks type I IFN-dependent STAT3 signalling in cells that are normally refractory to STAT3 transcriptional activation.",Tyk2-induced phosphorylation of STAT3 at Y640 was studied. This phosphorylation suppresses STAT3 transcriptional activity by destabilizing activated homodimers.,2026-07-20T16:50:17Z,d869c3f05d7ad827d7c50d2918067f8a42b501106300d79632f9b684bec7ca27,"paperclip, version 0.6.2","paperclip search -s pmc ""STAT1 TCR inhibition"" -n 10"
STAT1,STAT1 TCR inhibition,9,PMC12506346,,PARP inhibition augments immunomodulatory function of mesenchymal stem/stromal cells by promoting STAT1 phosphorylation,"Tingting Wang, Yanan Li, Jinyi Tian, Guofu Sun, Tingting Yang, Zhenzhen Meng, Wen Li, Xiao Su, Rui L...",2025,Stem Cell Research & Therapy,10.1186/s13287-025-04663-1,PMC12506346,41063195,https://www.ncbi.nlm.nih.gov/pmc/articles/PMC12506346/,research-article,True,True,source_heuristic(/papers=full-text),"Mesenchymal stem/stromal cells (MSCs) have shown significant therapeutic effects in a range of autoimmune and hyperinflammatory diseases through their strong immunomodulatory properties, both in animal models and clinical settings. Exposure to inflammatory cytokines is crucial for MSCs to acquire immunoregulatory functions; however, the detailed mechanisms underlying this process remain largely unexplored. MSCs with pharmacological inhibition or genetic knockout of poly ADP-ribose polymerase1 (PARP1) were treated with the inflammatory factors IFNγ and TNFα for 24 h. The mRNA and protein expression of chemokines and immunosuppressive molecules were detected by qRT-PCR and Western blotting, respectively. The therapeutic efficacy of MSCs was evaluated using a mouse concanavalin A-induced acute liver injury model and a dextran sulfate sodium-induced inflammatory bowel disease model. The phosphorylation of signal transducer and activator of transcription 1 (STAT1) was analyzed in activated MSCs, and STAT1 inhibition through either a STAT1 inhibitor or STAT1 knockout was employed to confirm the role of STAT1 in enhancing the immunoregulatory function of MSCs during PARP inhibition. PARP inhibition or genetic knockout of PARP1 further enhanced the immunoregulatory function of MSCs elicited by inflammatory cytokines IFNγ and TNFα, as evidenced by the upregulation of genes associated with immunoregulation in MSCs, augmentation of immunosuppressive functions of MSCs on T cells, and increased therapeutic effects of MSCs in mouse models of autoimmune and hyperinflammatory diseases. PARP inhibition was further shown to enhance the expression of immunosuppressive factors in primed MSCs through increased phosphorylation at the tyrosine 701 site on STAT1. Our study indicates that like its pro-inflammatory role in macrophages, PARP also functions to undermine the immunosuppressive effects of MSCs, and PARP inhibition represents a strategy to further unleash the immunoregulatory power of MSCs. The online version contains supplementary material available at 10.1186/s13287-025-04663-1.","PARP inhibition was studied to see how it affects mesenchymal stem/stromal cells (MSCs) exposed to inflammatory cytokines. PARP inhibition enhances MSC immunomodulatory function by increasing STAT1 phosphorylation, leading to improved therapeutic effects in inflammatory disease models.",2026-07-20T16:50:17Z,e7553befbd9aad5040524aabf4fa41a8820362fbcc6e25506e49af31f44f1afa,"paperclip, version 0.6.2","paperclip search -s pmc ""STAT1 TCR inhibition"" -n 10"
STAT1,STAT1 TCR inhibition,10,PMC1770918,,A time- and dose-dependent STAT1 expression system,"Nicole R Leitner, Birgit Strobl, Marion Bokor, Ronald Painz, Thomas Kolbe, Thomas Rülicke, Mathias M...",2006,BMC Biotechnology,10.1186/1472-6750-6-48,PMC1770918,17184522,https://www.ncbi.nlm.nih.gov/pmc/articles/PMC1770918/,research-article,True,True,source_heuristic(/papers=full-text),"The signal transducer and activator of transcription (STAT) family of transcription factors mediates a variety of cytokine dependent gene regulations. STAT1 has been mainly characterized by its role in interferon (IFN) type I and II signaling and STAT1 deficiency leads to high susceptibility to several pathogens. For fine-tuned analysis of STAT1 function we established a dimerizer-inducible system for STAT1 expression  in vitro  and  in vivo . The functionality of the dimerizer-induced STAT1 system is demonstrated  in vitro  in mouse embryonic fibroblasts and embryonic stem cells. We show that this two-vector based system is highly inducible and does not show any STAT1 expression in the absence of the inducer. Reconstitution of STAT1 deficient cells with inducible STAT1 restores IFNγ-mediated gene induction, antiviral responses and STAT1 activation remains dependent on cytokine stimulation. STAT1 expression is induced rapidly upon addition of dimerizer and expression levels can be regulated in a dose-dependent manner. Furthermore we show that in transgenic mice STAT1 can be induced upon stimulation with the dimerizer, although only at low levels. These results prove that the dimerizer-induced system is a powerful tool for STAT1 analysis  in vitro  and provide evidence that the system is suitable for the use in transgenic mice. To our knowledge this is the first report for inducible STAT1 expression in a time- and dose-dependent manner.","A dimerizer-inducible system for STAT1 expression was developed. This system allows for time- and dose-dependent STAT1 regulation, proving useful for in vitro analysis and transgenic mouse studies.",2026-07-20T16:50:17Z,38965bf988e7a80131e127dbff33741376a46c730b7de404844091a8007920a2,"paperclip, version 0.6.2","paperclip search -s pmc ""STAT1 TCR inhibition"" -n 10"
STAT4,STAT4 TCR inhibition,1,PMC12087874,,Biaryl Phosphates and Phosphonates as Selective Inhibitors of the Transcription Factor STAT4,"Nadiya Brovchenko, Angela Berg, Sabine Schubert, Julian Gräb, Theresa Münzel, Christoph Protzel, Kal...",2025,Angewandte Chemie (International Ed. in English),10.1002/anie.202504420,PMC12087874,40067743,https://www.ncbi.nlm.nih.gov/pmc/articles/PMC12087874/,research-article,True,True,source_heuristic(/papers=full-text),"The transcription factor STAT4 has been implicated in the pathogenesis of autoimmune diseases, including inflammatory bowel disease, multiple sclerosis, rheumatoid arthritis, and diabetes mellitus. Here, we report  p ‐biaryl phosphates and phosphonates as the first small‐molecule inhibitors of STAT4. The most potent  p ‐biaryl phosphate inhibited the protein–protein interaction domain of STAT4, the SH2 domain, with submicromolar potency ( K 
 i  = 0.35 µM) and 14‐fold selectivity over the closely related family member STAT3, which has the same core peptide binding motif as STAT4. Further development resulted in the phosphatase‐stable inhibitor Stafori‐1, which protected STAT4 but not STAT3, against thermal denaturation in cell lysates. Its cell‐permeable prodrug Pomstafori‐1 selectively inhibited STAT4 phosphorylation in cultured human cells at low micromolar concentrations. Our data open up the possibility of exploring STAT4 as a target protein for small molecules in the treatment of unmet medical needs.",Biaryl phosphates and phosphonates were developed as small-molecule inhibitors of the transcription factor STAT4. The most potent inhibitor selectively blocked STAT4's SH2 domain and showed promise in cell-based assays.,2026-07-20T16:50:24Z,ad4682d9aa64669f2718c0bd7173587fc3511fe05f55a138b7c7c3c2e1e5f8d1,"paperclip, version 0.6.2","paperclip search -s pmc ""STAT4 TCR inhibition"" -n 10"
STAT4,STAT4 TCR inhibition,2,PMC10849914,,TCR signaling induces STAT3 phosphorylation to promote T H 17 cell differentiation,"Zhen Qin, Ruining Wang, Ping Hou, Yuanyuan Zhang, Qianmu Yuan, Ying Wang, Yuedong Yang, Tao Xu",2024,The Journal of Experimental Medicine,10.1084/jem.20230683,PMC10849914,38324068,https://www.ncbi.nlm.nih.gov/pmc/articles/PMC10849914/,research-article,True,True,source_heuristic(/papers=full-text),"TCR signaling (signal 1) induces STAT3 phosphorylation through Lck/Fyn and, synergistically with cytokine signal (signal 3), induces optimal STAT3 phosphorylation to drive T H 17 cell differentiation. Selective inhibition of TCR stimulation–induced STAT3 phosphorylation significantly inhibits T H 17 differentiation and ameliorates T H 17 cell–related autoimmune diseases.","TCR signaling, in conjunction with cytokine signals, induces STAT3 phosphorylation to drive T H 17 cell differentiation. Inhibiting this TCR-induced phosphorylation reduces T H 17 differentiation and ameliorates related autoimmune diseases.",2026-07-20T16:50:24Z,2f145c5ee4912e00332f4f0007ba4ab8409b579fa1bb87509088069caab38a4f,"paperclip, version 0.6.2","paperclip search -s pmc ""STAT4 TCR inhibition"" -n 10"
STAT4,STAT4 TCR inhibition,3,PMC11989168,,DNA Methylation Mediates the Transcription of  STAT4  to Regulate  KISS1  During Follicular Development,"Danxia Chen, Ming Fang, Enyuan Huang, Hongyan Quan, Liuhong Zhang, Yingting He, Xiaofeng Zhou, Bin M...",2025,Cells,10.3390/cells14070523,PMC11989168,40214477,https://www.ncbi.nlm.nih.gov/pmc/articles/PMC11989168/,research-article,True,True,source_heuristic(/papers=full-text),"Maturation of follicles is the primary condition for the initiation of puberty, and excessive apoptosis of granulosa cells (GCs) will hinder the normal development of follicles in pigs. Signal Transducer and Activator of Transcription 4 ( STAT4 ) plays an important role in cell proliferation and apoptosis. However, the mechanism of DNA methylation regulating  STAT4  transcription and affecting follicle development in pigs remains unclear. To resolve this problem, we constructed a  STAT4  overexpression vector and interference fragment to explore the effects of  STAT4  on GC function and investigate the effects of changes in methylation status of the  STAT4  promoter region on cell function and kisspeptin-1 ( KISS1 ) expression, as well as the  STAT4  effects on the development of the follicles of pigs and mice in vitro. We found that the expression of  STAT4  decreased, while DNA methylation of the  STAT4  promoter region increased with the growth of the follicles. After overexpression of  STAT4 , the apoptosis of GCs was increased but the proliferation, cell cycle and estrogen secretion of GCs were inhibited. When GCs were treated with DNA methyltransferase inhibitor (5-Aza-CdR), the methylation of the  STAT4  promoter region decreased, resulting in a significant increase in the expression of  STAT4 . Consequently, the expression of  KISS1  was inhibited. At the same time, the expressions of genes related to cell proliferation, cell cycle and estrogen secretion signaling pathways decreased, while the expressions of genes related to the apoptosis signaling pathway increased. After infection with the  STAT4  lentiviral vector (LV- STAT4 ) in follicles of mice, the expression of  STAT4  in ovaries of mice significantly increased, and the expression of  KISS1  was significantly decreased. The capillaries on the surface of follicles were constricted, the age of puberty onset in mice was delayed while the levels of GnRH, LH, FSH and E2 in serum were decreased. In conclusion, we found that reduced methylation status of the  STAT4  promoter region promoted the transcription of  STAT4  and then inhibited the expression of  KISS1 , as well as promoted the apoptosis of GCs and ultimately inhibited the normal development of follicles in mammals.","DNA methylation of the STAT4 promoter was studied in relation to follicular development. Increased STAT4 methylation reduces STAT4 expression, inhibiting KISS1 and hindering follicle maturation.",2026-07-20T16:50:24Z,648e5ae21d92cab8263627da5844723809b119771fdafa6fa2b56f4789105985,"paperclip, version 0.6.2","paperclip search -s pmc ""STAT4 TCR inhibition"" -n 10"
STAT4,STAT4 TCR inhibition,4,PMC2196089,,Stat5 Synergizes with T Cell Receptor/Antigen Stimulation in the Development of Lymphoblastic Lymphoma,"John A. Kelly, Rosanne Spolski, Panu E. Kovanen, Takeshi Suzuki, Julie Bollenbacher, Cynthia A. Pise...",2003,The Journal of Experimental Medicine,10.1084/jem.20021548,PMC2196089,12835478,https://doi.org/10.1084/jem.20021548,research-article,True,True,source_heuristic(/papers=full-text),"Signal transducer and activator of transcription (STAT) proteins are latent transcription factors that mediate a wide range of actions induced by cytokines, interferons, and growth factors. We now report the development of thymic T cell lymphoblastic lymphomas in transgenic mice in which Stat5a or Stat5b is overexpressed within the lymphoid compartment. The rate of lymphoma induction was markedly enhanced by immunization or by the introduction of TCR transgenes. Remarkably, the Stat5 transgene potently induced development of CD8 +  T cells, even in mice expressing a class II–restricted TCR transgene, with resulting CD8 +  T cell lymphomas. These data demonstrate the oncogenic potential of dysregulated expression of a STAT protein that is not constitutively activated, and that TCR stimulation can contribute to this process.","This study investigated the role of Stat5 in T cell lymphoma development using transgenic mice. Overexpression of Stat5, especially with T cell receptor stimulation, significantly enhanced lymphoma formation and altered T cell development.",2026-07-20T16:50:24Z,ff55eded5fb3fba58744b084181e4724a5d9d1b526a8e88b946414bdce141719,"paperclip, version 0.6.2","paperclip search -s pmc ""STAT4 TCR inhibition"" -n 10"
STAT4,STAT4 TCR inhibition,5,PMC11578735,,STAT4 gene polymorphisms in human diseases,"Yan Xia, Yanni Xie, Hao Zhang, Lunzhi Liu",2024,Frontiers in Immunology,10.3389/fimmu.2024.1479418,PMC11578735,39575235,https://www.ncbi.nlm.nih.gov/pmc/articles/PMC11578735/,review-article,True,True,source_heuristic(/papers=full-text),"Signal transducer and activator of transcription 4 (STAT4) is a member of the STAT family, which is a group of transcription factors that regulate cytokine signaling. Genetic polymorphisms in STAT4 strongly influence immune responses and disease outcomes, especially in cancer and autoimmune diseases. Several studies have indicated that certain STAT4 gene variants are associated with alterations in STAT4 expression and/or activity and that there is a close relationship between STAT4 polymorphisms and drug efficacy. However, the underlying mechanisms are complex, and the roles of these polymorphisms in disease acquisition, progression, and severity are of widespread concern. Therefore, we provide an overview of the clinical significance of polymorphisms in STAT4 and the mechanisms by which these STAT4 variants are involved in various diseases.","This paper reviews STAT4 gene polymorphisms and their impact on immune responses and disease outcomes. These genetic variations are linked to disease acquisition, progression, severity, and drug efficacy.",2026-07-20T16:50:24Z,aa1ff6670bcdc460c96e36402ed556693993f9ff6baa225342075a92a0c8c4f7,"paperclip, version 0.6.2","paperclip search -s pmc ""STAT4 TCR inhibition"" -n 10"
STAT4,STAT4 TCR inhibition,6,PMC2195871,,Transient Inhibition of Interleukin 4 Signaling by T Cell Receptor Ligation,"Jinfang Zhu, Hua Huang, Liying Guo, Timothy Stonehouse, Cynthia J. Watson, Jane Hu-Li, William E. Pa...",2000,The Journal of Experimental Medicine,,PMC2195871,11034602,https://www.ncbi.nlm.nih.gov/pmc/articles/PMC2195871/,research-article,True,True,source_heuristic(/papers=full-text),"Interleukin (IL)-4 and IL-12 together with T cell receptor (TCR) engagement are crucial for the differentiation of CD4 +  T cells into T helper (Th)2 or Th1 cells, respectively. Although IL-4 receptors (IL-4Rs) but not IL-12Rs are expressed on naive CD4 +  T cells, IL-4 has no apparent advantage over IL-12 in driving naive T cell differentiation when the cells are primed with both IL-4 and IL-12 in vitro. It was found that IL-4–induced phosphorylation of Janus kinases 1 and 3, IL-4Rα, signal transducer and activator of transcription 6, and insulin receptor substrate 2 was strikingly but transiently inhibited by TCR ligation both in conventional and TCR transgenic T cells. TCR engagement also blocked the expression of an IL-4–inducible gene. Signals induced by other cytokines, including IL-2, IL-6, and interferon α, but not by insulin-like growth factor 1, were also blocked by TCR engagement. The capacity of various inhibitors to reverse TCR-mediated inhibition of IL-4 signaling suggested that activation of the Ras–mitogen-activated protein kinase pathway and of the calcineurin pathway contribute to desensitizing IL-4R. IL-4 responsiveness returned at about the time (∼12 h) that IL-12–mediated signaling was first observed. Thus, through different mechanisms, neither IL-4R nor IL-12R has any clear advantage in polarizing cells; rather, the availability of cytokine is probably the limiting factor in this process.","TCR ligation transiently inhibits IL-4 signaling in CD4+ T cells by activating Ras-MAPK and calcineurin pathways. This inhibition, along with cytokine availability, likely dictates T cell polarization rather than receptor advantage.",2026-07-20T16:50:24Z,28a7990f5c07de07b631cb13f8a03d895ed68f1ad646712463105962efcecc8a,"paperclip, version 0.6.2","paperclip search -s pmc ""STAT4 TCR inhibition"" -n 10"
