TF,exact_query,retrieval_rank,result_id,relevance_score,title,authors,year,journal,doi,pmcid,other_source_id,source_url,publication_type,abstract_available,full_text_available,full_text_available_method,abstract,snippet,retrieval_timestamp_utc,raw_response_sha256,paperclip_version,paperclip_command
AHR,AHR TCR inhibition,1,PMC12785682,,AHR Deficiency Exacerbates Hepatic Cholesterol Accumulation via Inhibiting Bile Acid Synthesis in MAFLD Rats,"Junjiu Xu, Pengwei Liu, Yuling Wu, Hongxiu He, Dandan Hu, Jianhua Sun, Jing Chen, Ying Tian, Likun G...",2025,International Journal of Molecular Sciences,10.3390/ijms27010349,PMC12785682,41516226,https://www.ncbi.nlm.nih.gov/pmc/articles/PMC12785682/,research-article,True,True,source_heuristic(/papers=full-text),"Metabolic-dysfunction-associated fatty liver disease (MAFLD) is a chronic liver disease characterized by abnormal lipid metabolism. The aryl hydrocarbon receptor (AHR) is a ligand-dependent transcription factor involved in regulating multiple physiological processes. Recent studies have demonstrated that AHR exerts a multifaceted regulatory role in liver diseases by integrating metabolic and immune signaling pathways; however, the specific role of AHR in MAFLD is not clear. In our work, a rat model of MAFLD was established by feeding wild-type (WT) and AHR knockout (AHR −/− ) rats with a high-fat, high-fructose, and high-cholesterol diet (HFHFrHCD) for 10 weeks, and then the liver injury markers, lipid-related biochemical indices and liver histopathology were examined to elucidate the effect of AHR on MAFLD progression. We discovered that AHR deficiency can elevate plasma transaminase levels, increase hepatic triglyceride (TG) and total cholesterol (TC), and exacerbate insulin resistance (IR) under an overnutrition environment. Subsequently, liver transcriptome and RT-qPCR were performed to investigate the underlying mechanism, which revealed that the hepatic bile acid synthesis was inhibited because of lower  Cytochrome P450 Family 7 Subfamily A Member 1 (CYP7A1)  expression in the liver when AHR was knockout. Additionally, intestinal flora dysbiosis occurred in AHR −/−  rats fed with HFHFrHCD, which might also contribute to the hepatic cholesterol accumulation. Taken together, our results suggested that AHR might play an important role in regulating cholesterol metabolism by inhibiting bile acid synthesis and breaking the steady state of the gut microbiota during the MAFLD progression.",A study investigated the role of AHR deficiency in MAFLD using a rat model. AHR deficiency exacerbates hepatic cholesterol accumulation by inhibiting bile acid synthesis.,2026-07-20T16:45:35Z,2d1b6d06c6b36d2c93c18fb5a5912d05c25f1eb26844d9ee87756075be5a8a70,"paperclip, version 0.6.2","paperclip search -s pmc ""AHR TCR inhibition"" -n 10"
AHR,AHR TCR inhibition,2,PMC7419300,,Blockade of the AHR restricts a Treg-macrophage suppressive axis induced by L-Kynurenine,"Luis Felipe Campesato, Sadna Budhu, Jeremy Tchaicha, Chien-Huan Weng, Mathieu Gigoux, Ivan Jose Cohe...",2020,Nature Communications,10.1038/s41467-020-17750-z,PMC7419300,32782249,https://doi.org/10.1038/s41467-020-17750-z,research-article,True,True,source_heuristic(/papers=full-text),"Tryptophan catabolism by the enzymes indoleamine 2,3-dioxygenase 1 and tryptophan 2,3-dioxygenase 2 (IDO/TDO) promotes immunosuppression across different cancer types. The tryptophan metabolite L-Kynurenine (Kyn) interacts with the ligand-activated transcription factor aryl hydrocarbon receptor (AHR) to drive the generation of Tregs and tolerogenic myeloid cells and PD-1 up-regulation in CD8 +  T cells. Here, we show that the AHR pathway is selectively active in IDO/TDO-overexpressing tumors and is associated with resistance to immune checkpoint inhibitors. We demonstrate that IDO-Kyn-AHR-mediated immunosuppression depends on an interplay between Tregs and tumor-associated macrophages, which can be reversed by AHR inhibition. Selective AHR blockade delays progression in IDO/TDO-overexpressing tumors, and its efficacy is improved in combination with PD-1 blockade. Our findings suggest that blocking the AHR pathway in IDO/TDO expressing tumors would overcome the limitation of single IDO or TDO targeting agents and constitutes a personalized approach to immunotherapy, particularly in combination with immune checkpoint inhibitors.",The aryl hydrocarbon receptor (AHR) pathway was studied in tumors overexpressing IDO/TDO. Blocking AHR reverses Treg-macrophage immunosuppression and improves immunotherapy efficacy.,2026-07-20T16:45:35Z,ca82b4589209389768bebf2a7ad97277aeda77a596e63cff57cd64f27ad4f53c,"paperclip, version 0.6.2","paperclip search -s pmc ""AHR TCR inhibition"" -n 10"
AHR,AHR TCR inhibition,3,PMC12801039,,Aroclor 1254 inhibits anti-inflammatory macrophage polarization through an AhR-dependent mechanism,"Riley M Behan-Bush, Elizabeth Kilburg, Jesse N Liszewski, Michael V Schrodt, Edward A Sander, Aloysi...",2026,Journal of the Endocrine Society,10.1210/jendso/bvaf205,PMC12801039,41541288,https://www.ncbi.nlm.nih.gov/pmc/articles/PMC12801039/,research-article,True,True,source_heuristic(/papers=full-text),"Macrophages are critical regulators of tissue homeostasis and inflammation. During the development of chronic inflammatory diseases, tissue-resident macrophages often shift from an anti-inflammatory (M2) to a pro-inflammatory (M1) phenotype. Understanding the factors that drive this polarization shift is essential for elucidating the mechanisms underlying diseases such as cancer, cardiovascular disease, and metabolic syndrome. Environmental toxicants, including polychlorinated biphenyls (PCBs), may be key contributors to this dysregulation. Despite being banned in the United States for nearly 50 years, PCBs persist in the built and natural environment, with mixtures such as Aroclor 1254 still detected at concerning levels in schools and other public spaces. In this study, we investigated how Aroclor 1254 influences human monocyte-derived macrophage polarization. We found that exposure to Aroclor 1254 during differentiation skews naïve macrophages toward a pro-inflammatory phenotype, enhances LPS/IFNγ-driven M1 polarization, and inhibits both IL-4- and dexamethasone-induced M2 polarization. To explore underlying mechanisms, we examined the roles of peroxisome proliferator-activated receptor gamma (PPARγ), pyruvate kinase M2 (PKM2), and the aryl hydrocarbon receptor (AhR). We found AhR inhibition partially rescued PCB-mediated suppression of M2 polarization. Further supporting this mechanism, PCB126, a potent AhR agonist, recapitulated the disruption of polarization. Together, these findings demonstrate that PCB mixtures act through AhR to dysregulate macrophage polarization, driving a pro-inflammatory phenotype. This disruption may represent a key mechanism by which PCBs exacerbate tissue inflammation and contribute to the pathogenesis of chronic inflammatory diseases.","Aroclor 1254 exposure was studied for its effects on human macrophage polarization. The toxicant inhibits anti-inflammatory M2 polarization via an AhR-dependent mechanism, promoting a pro-inflammatory state.",2026-07-20T16:45:35Z,d42217d86987738ad48eb67b02f32c3e3513a36aafd4aad4fb36f93f411825b4,"paperclip, version 0.6.2","paperclip search -s pmc ""AHR TCR inhibition"" -n 10"
AHR,AHR TCR inhibition,4,PMC12504769,,Beneficial and detrimental consequences of AHR activation in intestinal infection,"Oscar E Diaz, Liang Zhou, Christopher Barrington, Dennis Lindqvist, Frederike Graelmann, Emma Wincen...",2025,Life Science Alliance,10.26508/lsa.202503414,PMC12504769,41057229,https://www.ncbi.nlm.nih.gov/pmc/articles/PMC12504769/,research-article,True,True,source_heuristic(/papers=full-text),"AHR activation can positively or negatively affect immune responses. Here, we investigate whether TCDD toxicity is due to prolonged duration of AHR activation and show that duration of stimulation is not responsible on its own.",This study investigated the consequences of AHR activation in intestinal infection. Prolonged duration of AHR activation alone does not explain TCDD toxicity.,2026-07-20T16:45:35Z,b65c0334c844a36d260631c115d4b545780060fc6b9d37be7fd6171476eacc14,"paperclip, version 0.6.2","paperclip search -s pmc ""AHR TCR inhibition"" -n 10"
AHR,AHR TCR inhibition,5,PMC11354967,,Indoxyl Sulfate Inhibits Osteogenesis in Bone Marrow Mesenchymal Stem Cells through the AhR/Hes1 Pathway,"Chin-Wen Hsieh, Ling-Hua Chang, Yan-Hsiung Wang, Wei-Ting Li, Je-Ken Chang, Chung-Hwan Chen, Mei-Lin...",2024,International Journal of Molecular Sciences,10.3390/ijms25168770,PMC11354967,39201457,https://www.ncbi.nlm.nih.gov/pmc/articles/PMC11354967/,research-article,True,True,source_heuristic(/papers=full-text),"Uremic toxins cause bone disorders in patients with chronic kidney disease (CKD). These disorders are characterized by low turnover osteodystrophy and impaired bone formation in the early stages of CKD. Evidence indicates that the aryl hydrocarbon receptor (AhR) mediates signals that suppress early osteogenic differentiation in bone marrow mesenchymal stem cells (BMSCs). However, whether the AhR mediates the effects of indoxyl sulfate (IS), a uremic toxin, on BMSC osteogenesis remains unclear. We investigated whether IS affects osteogenesis through the AhR/Hes1 pathway. Expression levels of osteogenesis genes ( Runx2 ,  Bmp2 ,  Alp , and  Oc ), AhR, and Hes1 were measured in mouse BMSCs (D1 cells). At concentrations of 2–50 μM, IS significantly reduced mineralization, particularly in the early stages of BMSC osteogenesis. Furthermore, IS significantly downregulated the expression of  Runx2 ,  Bmp2 ,  Oc , and  Alp . Notably, this downregulation could be prevented using an AhR antagonist and through  Ahr  knockdown. Mechanistically, IS induced the expression of  Hes1  through AhR signaling, thereby suppressing the transcription of  Runx2  and  Bmp2 . Our findings suggest that IS inhibits early osteogenesis of BMSCs through the AhR/Hes1 pathway, thus suppressing the transcription of  Runx2  and  Bmp2 . Our findings may guide new therapeutic strategies against CKD-related bone disorders.","Indoxyl sulfate was studied for its effect on bone marrow mesenchymal stem cell osteogenesis. It inhibits osteogenesis by activating the AhR/Hes1 pathway, downregulating key osteogenic genes.",2026-07-20T16:45:35Z,cb920c00b83aa55c290f1945a29f14ded51377b1ac2165d838a0c9fa22639863,"paperclip, version 0.6.2","paperclip search -s pmc ""AHR TCR inhibition"" -n 10"
AHR,AHR TCR inhibition,6,PMC10570930,,The complex biology of aryl hydrocarbon receptor activation in cancer and beyond,"Christiane A. Opitz, Pauline Holfelder, Mirja Tamara Prentzell, Saskia Trump",2023,Biochemical Pharmacology,10.1016/j.bcp.2023.115798,PMC10570930,37696456,https://www.ncbi.nlm.nih.gov/pmc/articles/PMC10570930/,review-article,True,True,source_heuristic(/papers=full-text),The complex biology of AHR activation in cancer and beyond. Graphical abstract depicts the contributing factors to AHR's context specificity. Created with BioRender.com (agreement number: HI25TPR0Z5),This paper reviews the complex biology of aryl hydrocarbon receptor (AHR) activation. AHR's context-specific activity is influenced by multiple contributing factors.,2026-07-20T16:45:35Z,0ead10103389c05d8e5f4c9e7f8b4a7ce918ef041a4682a13efb2fcafa009e99,"paperclip, version 0.6.2","paperclip search -s pmc ""AHR TCR inhibition"" -n 10"
AHR,AHR TCR inhibition,7,PMC11237943,,A novel gain-of-function phosphorylation site modulates PTPN22 inhibition of TCR signaling,"Chuling Zhuang, Shen Yang, Carlos G. Gonzalez, Richard I. Ainsworth, Sheng Li, Masumi Takayama Kobay...",2024,The Journal of Biological Chemistry,10.1016/j.jbc.2024.107393,PMC11237943,38777143,https://www.ncbi.nlm.nih.gov/pmc/articles/PMC11237943/,research-article,True,True,source_heuristic(/papers=full-text),"Protein tyrosine phosphatase nonreceptor type 22 (PTPN22) is encoded by a major autoimmunity gene and is a known inhibitor of T cell receptor (TCR) signaling and drug target for cancer immunotherapy. However, little is known about PTPN22 posttranslational regulation. Here, we characterize a phosphorylation site at Ser 325  situated C terminal to the catalytic domain of PTPN22 and its roles in altering protein function. In human T cells, Ser 325  is phosphorylated by glycogen synthase kinase-3 (GSK3) following TCR stimulation, which promotes its TCR-inhibitory activity. Signaling through the major TCR-dependent pathway under PTPN22 control was enhanced by CRISPR/Cas9-mediated suppression of Ser 325  phosphorylation and inhibited by mimicking it  via  glutamic acid substitution. Global phospho-mass spectrometry showed Ser 325  phosphorylation state alters downstream transcriptional activity through enrichment of Swi3p, Rsc8p, and Moira domain binding proteins, and next-generation sequencing revealed it differentially regulates the expression of chemokines and T cell activation pathways. Moreover,  in vitro  kinetic data suggest the modulation of activity depends on a cellular context. Finally, we begin to address the structural and mechanistic basis for the influence of Ser 325  phosphorylation on the protein’s properties by deuterium exchange mass spectrometry and NMR spectroscopy. In conclusion, this study explores the function of a novel phosphorylation site of PTPN22 that is involved in complex regulation of TCR signaling and provides details that might inform the future development of allosteric modulators of PTPN22.","A novel phosphorylation site (Ser 325) on PTPN22 was identified and characterized. This site enhances PTPN22's inhibitory effect on TCR signaling, potentially influencing autoimmune diseases and cancer immunotherapy.",2026-07-20T16:45:35Z,68b5e6bc463149a91c18620aebede510e00af067ce9536683576ece45ab240b7,"paperclip, version 0.6.2","paperclip search -s pmc ""AHR TCR inhibition"" -n 10"
AHR,AHR TCR inhibition,8,PMC4067745,,Activation of the Aryl Hydrocarbon Receptor Dampens the Severity of Inflammatory Skin Conditions,"Paola Di Meglio, João H. Duarte, Helena Ahlfors, Nick D.L. Owens, Ying Li, Federica Villanova, Isabe...",2014,Immunity,10.1016/j.immuni.2014.04.019,PMC4067745,24909886,https://www.ncbi.nlm.nih.gov/pmc/articles/PMC4067745/,research-article,True,True,source_heuristic(/papers=full-text),"Environmental stimuli are known to contribute to psoriasis pathogenesis and that of other autoimmune diseases, but the mechanisms are largely unknown. Here we show that the aryl hydrocarbon receptor (AhR), a transcription factor that senses environmental stimuli, modulates pathology in psoriasis. AhR-activating ligands reduced inflammation in the lesional skin of psoriasis patients, whereas AhR antagonists increased inflammation. Similarly, AhR signaling via the endogenous ligand FICZ reduced the inflammatory response in the imiquimod-induced model of skin inflammation and AhR-deficient mice exhibited a substantial exacerbation of the disease, compared to AhR-sufficient controls. Nonhematopoietic cells, in particular keratinocytes, were responsible for this hyperinflammatory response, which involved upregulation of AP-1 family members of transcription factors. Thus, our data suggest a critical role for AhR in the regulation of inflammatory responses and open the possibility for novel therapeutic strategies in chronic inflammatory disorders.","The aryl hydrocarbon receptor (AhR) was studied for its role in inflammatory skin conditions like psoriasis. AhR activation was found to reduce disease severity, while its deficiency exacerbated inflammation.",2026-07-20T16:45:35Z,6dbb2a3868621eee6bb90a21a7e0e65e72e63c1eee04768e96c8a8a1244da7d5,"paperclip, version 0.6.2","paperclip search -s pmc ""AHR TCR inhibition"" -n 10"
AHR,AHR TCR inhibition,9,PMC12346228,,Exploiting TCR Repertoire Analysis to Select Therapeutic TCRs for Cancer Immunotherapy,"Ursule M. Demaël, Thunchanok Rirkkrai, Fatma Zehra Okus, Andreas Tiffeau-Mayer, Hans J. Stauss",2025,Cells,10.3390/cells14151223,PMC12346228,40801654,https://www.ncbi.nlm.nih.gov/pmc/articles/PMC12346228/,review-article,True,True,source_heuristic(/papers=full-text),"Over the past decade, numerous innovative immunotherapy strategies have transformed the treatment of cancer and improved the survival of patients unresponsive to conventional chemotherapy and radiation therapy. Immune checkpoint inhibition approaches aim to block negative regulatory pathways that limit the function of endogenous T cells, while adoptive cell therapy produces therapeutic T cells with high functionality and defined cancer specificity. While CAR engineering successfully targets cancer surface antigens, TCR engineering enables targeting of the entire cancer proteome, including mutated neo-antigens. To date, TCR engineering strategies have focused on the identification of target cancer antigens recognised by well-characterised therapeutic TCRs. In this review, we explore whether antigen-focused approaches could be complemented by TCR-focused approaches, whereby information of the TCR repertoire of individual patients provides the basis for selecting TCRs to engineer autologous T cells for adoptive cell therapy. We discuss how TCR clonality profiles, distribution in T cell subsets, and bioinformatic screening against continuously improving TCR databases can guide the selection of TCRs for therapeutic application. We further outline in vitro approaches to prioritise TCR candidates to confirm cancer reactivity and exclude recognition of healthy autologous cells, which could provide validation for their therapeutic use even when the target antigen remains unknown.",This review explores using individual patient TCR repertoire data to select T cells for adoptive cancer immunotherapy. Such TCR-focused approaches could complement antigen-focused strategies by identifying functional TCRs even when the target antigen is unknown.,2026-07-20T16:45:35Z,d8bac7f40a18f8645487a5291f0b05072df5a888c1c48915926b2af230f9baa0,"paperclip, version 0.6.2","paperclip search -s pmc ""AHR TCR inhibition"" -n 10"
AHR,AHR TCR inhibition,10,PMC3412388,,Aryl Hydrocarbon Receptor-Mediated Perturbations in Gene Expression during Early Stages of CD4 +  T-cell Differentiation,"Diana Rohlman, Duy Pham, Zhen Yu, Linda B. Steppan, Nancy I. Kerkvliet",2012,Frontiers in Immunology,10.3389/fimmu.2012.00223,PMC3412388,22888330,https://www.ncbi.nlm.nih.gov/pmc/articles/PMC3412388/,research-article,True,True,source_heuristic(/papers=full-text),"Activation of the aryl hydrocarbon receptor (AhR) by its prototypic ligand, 2,3,7,8-tetrachlorodibenzo- p -dioxin (TCDD), mediates potent suppression of T-cell dependent immune responses. The suppressive effects of TCDD occur early during CD4 +  T-cell differentiation in the absence of effects on proliferation and have recently been associated with the induction of AhR-dependent regulatory T-cells (Treg). Since AhR functions as a ligand-activated transcription factor, changes in gene expression induced by TCDD during the early stages of CD4 +  T-cell differentiation are likely to reflect fundamental mechanisms of AhR action. A custom panel of genes associated with T-cell differentiation was used to query changes in gene expression induced by exposure to 1 nM TCDD. CD4 +  T-cells from AhR +/+  and AhR −/−  mice were cultured with cytokines known to polarize the differentiation of T-cells to various effector lineages. Treatment with TCDD induced the expression of  Cyp1a1 ,  Cyp1b1 , and  Ahrr  in CD4 +  T-cells from AhR +/+  mice under all culture conditions, validating the presence and activation of AhR in these cells. The highest levels of AhR activation occurred under Th17 conditions at 24 h and Tr1 conditions at 48 h. Unexpectedly, expression levels of most genes associated with early T-cell differentiation were unaltered by AhR activation, including lineage-specific genes that drive CD4 +  T-cell polarization. The major exception was AhR-dependent up-regulation of  Il22  that was seen under all culture conditions. Independent of TCDD, AhR down-regulated the expression of  Il17a  and  Rorc  based on increased expression of these genes in AhR-deficient cells across culture conditions. These findings are consistent with a role for AhR in down-regulation of inflammatory immune responses and implicate IL-22 as a potential contributor to the immunosuppressive effects of TCDD.","This study investigated gene expression changes in CD4+ T-cells upon aryl hydrocarbon receptor activation. AhR activation primarily up-regulated IL-22 and down-regulated IL-17a and Rorc, suggesting a role in suppressing inflammatory responses.",2026-07-20T16:45:35Z,933d59000cfcac58d75fe5c9ae7f9ed3104ea6ec765b38e362046f61bfe23661,"paperclip, version 0.6.2","paperclip search -s pmc ""AHR TCR inhibition"" -n 10"
BCL3,BCL3 TCR inhibition,1,PMC10775530,,Multifaceted roles for BCL3 in cancer: a proto-oncogene comes of age,"Gillian Seaton, Hannah Smith, Andrea Brancale, Andrew D. Westwell, Richard Clarkson",2024,Molecular Cancer,10.1186/s12943-023-01922-8,PMC10775530,38195591,https://www.ncbi.nlm.nih.gov/pmc/articles/PMC10775530/,review-article,True,True,source_heuristic(/papers=full-text),"In the early 1990’s a group of unrelated genes were identified from the sites of recurring translocations in B-cell lymphomas. Despite sharing the nomenclature ‘Bcl’, and an association with blood-borne cancer, these genes have unrelated functions. Of these genes, BCL2 is best known as a key cancer target involved in the regulation of caspases and other cell viability mechanisms. BCL3 on the other hand was originally identified as a non-canonical regulator of NF-kB transcription factor pathways – a signaling mechanism associated with important cell outcomes including many of the hallmarks of cancer. Most of the early investigations into BCL3 function have since focused on its role in NF-kB mediated cell proliferation, inflammation/immunity and cancer. However, recent evidence is coming to light that this protein directly interacts with and modulates a number of other signaling pathways including DNA damage repair, WNT/β-catenin, AKT, TGFβ/SMAD3 and STAT3 – all of which have key roles in cancer development, metastatic progression and treatment of solid tumours. Here we review the direct evidence demonstrating BCL3’s central role in a transcriptional network of signaling pathways that modulate cancer biology and treatment response in a range of solid tumour types and propose common mechanisms of action of BCL3 which may be exploited in the future to target its oncogenic effects for patient benefit.",This paper reviews the multifaceted roles of BCL3 in cancer. BCL3 is a proto-oncogene that modulates multiple signaling pathways involved in cancer development and treatment response.,2026-07-20T16:47:26Z,b072279297a9bb8e8a4d44c9b130efe79ccf01075c704af579a71a2692bd69c5,"paperclip, version 0.6.2","paperclip search -s pmc ""BCL3 TCR inhibition"" -n 10"
BCL3,BCL3 TCR inhibition,2,PMC10813424,,Suppression of Bcl3 Disrupts Viability of Breast Cancer Cells through Both p53-Dependent and p53-Independent Mechanisms via Loss of NF-κB Signalling,"Daniel J. Turnham, Hannah Smith, Richard W. E. Clarkson",2024,Biomedicines,10.3390/biomedicines12010143,PMC10813424,38255248,https://www.ncbi.nlm.nih.gov/pmc/articles/PMC10813424/,research-article,True,True,source_heuristic(/papers=full-text),"The NF-κB co-factor Bcl3 is a proto-oncogene that promotes breast cancer proliferation, metastasis and therapeutic resistance, yet its role in breast cancer cell survival is unclear. Here, we sought to determine the effect of Bcl3 suppression alone on breast cancer cell viability, with a view to informing future studies that aim to target Bcl3 therapeutically. Bcl3 was suppressed by siRNA in breast cancer cell lines before changes in viability, proliferation, apoptosis and senescence were examined. Bcl3 suppression significantly reduced viability and was shown to induce apoptosis in all cell lines tested, while an additional p53-dependent senescence and senescence-associated secretory phenotype was also observed in those cells with functional p53. The role of the Bcl3/NF-κB axis in this senescence response was confirmed via siRNA of the non-canonical NF-κB subunit NFKB2/p52, which resulted in increased cellular senescence and the canonical subunit NFKB1/p50, which induced the senescence-associated secretory phenotype. An analysis of clinical data showed a correlation between reduced relapse-free survival in patients that expressed high levels of Bcl3 and carried a p53 mutation. Together, these data demonstrate a dual role for Bcl3/NF-κB in the maintenance of breast cancer cell viability and suggests that targeting Bcl3 may be more beneficial to patients with tumours that lack functional p53.","Bcl3 suppression was studied in breast cancer cells to assess its impact on viability. Bcl3 loss significantly reduced viability and induced apoptosis, with p53-dependent senescence also observed.",2026-07-20T16:47:26Z,6ecf8ed595ddcb961b38ca188b0b552b758de406c78ca3b71a270bd2ee16ef28,"paperclip, version 0.6.2","paperclip search -s pmc ""BCL3 TCR inhibition"" -n 10"
