TF,exact_query,retrieval_rank,result_id,relevance_score,title,authors,year,journal,doi,pmcid,other_source_id,source_url,publication_type,abstract_available,full_text_available,full_text_available_method,abstract,snippet,retrieval_timestamp_utc,raw_response_sha256,paperclip_version,paperclip_command
MDM2,MDM2 TCR inhibition,8,PMC11251213,,The role of the MDM2/p53 axis in antitumor immune responses,"Tilman Brummer, Robert Zeiser",2023,Blood,10.1182/blood.2023020731,PMC11251213,37467495,https://www.ncbi.nlm.nih.gov/pmc/articles/PMC11251213/,review-article,True,True,source_heuristic(/papers=full-text),"Mouse double minute 2 homolog (MDM2) is a negative regulator of the tumor suppressor p53 and is often highly expressed in acute myeloid leukemia (AML) and other solid tumors. Inactivating mutations in  TP53 , the gene encoding p53, confers an unfavorable prognosis in AML and increases the risk for relapse after allogeneic hematopoietic cell transplantation. We review the concept that manipulation of MDM2 and p53 could enhance immunogenicity of AML and solid tumor cells. Additionally, we discuss the mechanisms by which MDM2 and p53 regulate the expression of major histocompatibility complex class I and II, transcription of double stranded RNA of endogenous retroviruses, responses of interferons, production of interleukin-15, and expression of tumor necrosis factor–related apoptosis–inducing ligand receptor 1 and 2 on malignant cells. The direct effects of MDM2 inhibition or MDM2 deletion in effector T cells are discussed in the context of cancer immunotherapy. The preclinical findings are connected to clinical studies using MDM2 inhibition to enhance antitumor immunity in patients. This review summarizes current evidence supporting the use of MDM2 inhibition to restore p53 as well as the direct effects of MDM2 inhibition on T cells as an emerging concept for combined antitumor immunotherapy against hematological malignancies and beyond. Introduced by Associate Editor Robert Zeiser, this Review Series focuses on the problem of immune escape by acute myeloid leukemia (AML). The series opens with a review of how AML escapes T-cell–driven elimination and then focuses on how p53 function impinges on AML recognition by immune cells. The series finishes with a summary of new approaches to tackling this major problem.","This paper reviews how the MDM2/p53 axis influences tumor immunogenicity and immune cell function. Inhibiting MDM2 can enhance antitumor immunity by restoring p53 and directly affecting T cells, offering a new immunotherapy strategy.",2026-07-20T16:49:10Z,e2da85b43be02c2bb48a681f092603d799aa6886fa6d0da8e4789f9acbc69bce,"paperclip, version 0.6.2","paperclip search -s pmc ""MDM2 TCR inhibition"" -n 10"
MDM2,MDM2 TCR inhibition,9,PMC11497104,,FGF12 Positively Regulates Keratinocyte Proliferation by Stabilizing MDM2 and Inhibiting p53 Activity in Psoriasis,"Nan Wang, Xiejun Xu, Fangqian Guan, Yifan Lin, Yizhou Ye, Jie Zhou, Jianjun Feng, Sihang Li, Junbo Y...",2024,Advanced Science,10.1002/advs.202400107,PMC11497104,39234815,https://www.ncbi.nlm.nih.gov/pmc/articles/PMC11497104/,research-article,True,True,source_heuristic(/papers=full-text),"Psoriasis is a chronic skin disease characterized by abnormal proliferation and inflammation of epidermal keratinocytes. Fibroblast growth factor 12 (FGF12) is implicated in the regulation of diverse cellular signals; however, its precise mechanism in psoriasis requires further investigation. In this study, high expression of FGF12 is observed in the epidermis of skin lesion in psoriasis patients and imiquimod (IMQ)‐induced psoriasis like‐dermatitis. Moreover, specific loss of FGF12 in keratinocytes in IMQ‐induced psoriasis model alleviates psoriasis‐like symptoms and reduces proliferation. In vitro RNA sequencing demonstrates that knockdown of FGF12 effectively arrests the cell cycle, inhibits cell proliferation, and predominantly regulates the p53 signaling pathway. Mechanistically, FGF12 is selectively bound to the RING domain of MDM2, thus partially inhibiting the binding of β‐Trcp to MDM2. This interaction inhibits β‐Trcp‐induced‐K48 ubiquitination degradation of MDM2, thereby suppressing the activity of the p53 signaling pathway, which results in excessive cell proliferation. Last, the alleviatory effect of FGF12 deficiency on psoriasis progression is reversed by p53 knockdown. In summary, these findings provide valuable insights into the mechanisms by which FGF12 suppresses p53 signaling in keratinocytes, exacerbating the development of psoriasis. This positive regulatory loop highlights the potential of FGF12 as a therapeutic target to manage psoriasis.","FGF12 was studied for its role in keratinocyte proliferation in psoriasis. It stabilizes MDM2, inhibiting p53 and promoting proliferation, suggesting FGF12 is a therapeutic target.",2026-07-20T16:49:10Z,d46ef24ee87023ece59da3c2a3161a43fa7e8fbd92f327b35a6d63e84bfad42e,"paperclip, version 0.6.2","paperclip search -s pmc ""MDM2 TCR inhibition"" -n 10"
MDM2,MDM2 TCR inhibition,10,PMC3641235,,In Vitro  Selection of Mutant HDM2 Resistant to Nutlin Inhibition,"Siau Jia Wei, Thomas Joseph, Adelene Y. L. Sim, Larisa Yurlova, Kourosh Zolghadr, David Lane, Chandr...",2013,PLoS ONE,10.1371/journal.pone.0062564,PMC3641235,23653682,https://www.ncbi.nlm.nih.gov/pmc/articles/PMC3641235/,research-article,True,True,source_heuristic(/papers=full-text),"HDM2 binds to the p53 tumour suppressor and targets it for proteosomal degradation. Presently in clinical trials, the small molecule Nutlin-3A competitively binds to HDM2 and abrogates its repressive function. Using a novel  in vitro  selection methodology, we simulated the emergence of resistance by evolving HDM2 mutants capable of binding p53 in the presence of Nutlin concentrations that inhibit the wild-type HDM2-p53 interaction. The  in vitro  phenotypes were recapitulated in  ex vivo  assays measuring both p53 transactivation function and the direct p53-HDM2 interaction in the presence of Nutlin. Mutations conferring drug resistance were not confined to the N-terminal p53/Nutlin–binding domain, and were additionally seen in the acidic, zinc finger and RING domains. Mechanistic insights gleaned from this broad spectrum of mutations will aid in future drug design and further our understanding of the complex p53-HDM2 interaction.","Mutant HDM2 proteins were evolved *in vitro* to resist Nutlin inhibition of the p53 interaction. Resistance mutations arose in multiple HDM2 domains, not just the binding site, offering insights for future drug design.",2026-07-20T16:49:10Z,69bf230a94c9416d6731107bc6b0e89019c5b276f56c992749197affe6d2aef4,"paperclip, version 0.6.2","paperclip search -s pmc ""MDM2 TCR inhibition"" -n 10"
MLX,MLX TCR inhibition,1,PMC11398402,,MLX phosphorylation stabilizes the ChREBP-MLX heterotetramer on tandem E-boxes to control carbohydrate and lipid metabolism,"Carla E Cadena del Castillo, Onur Deniz, Femke van Geest, Lore Rosseels, Ingrid Stockmans, Marius Ro...",2024,bioRxiv,10.1101/2024.09.04.611172,PMC11398402,39282306,https://www.ncbi.nlm.nih.gov/pmc/articles/PMC11398402/,research-article,True,True,source_heuristic(/papers=full-text),"The heterodimeric ChREBP-MLX transcription factor complex is a key mediator that couples intracellular sugar levels to carbohydrate and lipid metabolism. To promote the expression of target genes, two ChREBP-MLX heterodimers form a heterotetramer to bind a tandem element with two adjacent E-boxes, called Carbohydrate Responsive Element (ChoRE). How the ChREBP-MLX hetero-tetramerization is achieved and regulated, remains poorly understood. Here we show that MLX phosphorylation on an evolutionarily conserved motif is necessary for the heterotetramer formation on the ChoRE and the transcriptional activity of the ChREBP-MLX complex. We identified CK2 and GSK3 as MLX kinases that coordinately phosphorylate MLX. High intracellular glucose-6-phosphate accumulation inhibits MLX phosphorylation and heterotetramer formation on the ChoRE, impairing ChREBP-MLX activity. Physiologically, MLX phosphorylation is necessary in  Drosophila  to maintain sugar tolerance and lipid homeostasis. Our findings suggest that MLX phosphorylation is a key mechanism for the ChREBP-MLX heterotetramer formation to regulate carbohydrate and lipid metabolism.",MLX phosphorylation was studied as a regulator of ChREBP-MLX heterotetramer formation. This phosphorylation is crucial for heterotetramer binding to DNA and controlling metabolic gene expression.,2026-07-20T16:49:15Z,649280f20c304c89c15231e654286d4d4e963917a7786ae75a7feac137d36caa,"paperclip, version 0.6.2","paperclip search -s pmc ""MLX TCR inhibition"" -n 10"
MLX,MLX TCR inhibition,2,PMC8978620,,A Costimulatory CAR Improves TCR-based Cancer Immunotherapy,"Bilal Omer, Mara G. Cardenas, Thomas Pfeiffer, Rachel Daum, Mai Huynh, Sandhya Sharma, Nazila Nourae...",2022,Cancer Immunology Research,10.1158/2326-6066.CIR-21-0307,PMC8978620,35176142,https://doi.org/10.1158/2326-6066.CIR-21-0307,research-article,True,True,source_heuristic(/papers=full-text),"This proof-of-concept study demonstrates that TCR-based therapies can be improved with engineered T cells expressing a costimulatory chimeric antigen receptor (CoCAR). CoCAR+ T cells are able to kill TCR targets, while sparing normal cells expressing the CoCAR antigen.",TCR-based cancer immunotherapy was enhanced by engineering T cells to express a costimulatory chimeric antigen receptor (CoCAR). CoCAR+ T cells effectively killed target cells while sparing normal cells expressing the CoCAR antigen.,2026-07-20T16:49:15Z,214021dd42bd63d6541babc2146bf946555c4950e21ab4dfed986d3b3a6f4db9,"paperclip, version 0.6.2","paperclip search -s pmc ""MLX TCR inhibition"" -n 10"
MLX,MLX TCR inhibition,3,PMC11900861,,MLX phosphorylation stabilizes the ChREBP-MLX heterotetramer on tandem E-boxes to control carbohydrate and lipid metabolism,"Carla E. Cadena del Castillo, Onur Deniz, Femke van Geest, Lore Rosseels, Ingrid Stockmans, Marius R...",2025,Science Advances,10.1126/sciadv.adt4548,PMC11900861,40073115,https://www.ncbi.nlm.nih.gov/pmc/articles/PMC11900861/,research-article,True,True,source_heuristic(/papers=full-text),"Carbohydrate-responsive element binding protein (ChREBP) and Max-like protein X (MLX) form a heterodimeric transcription factor complex that couples intracellular sugar levels to carbohydrate and lipid metabolism. To promote the expression of target genes, two ChREBP-MLX heterodimers form a heterotetramer to bind a tandem element with two adjacent E-boxes, called carbohydrate-responsive element (ChoRE). How the ChREBP-MLX hetero-tetramerization is achieved and regulated remains poorly understood. Here, we show that MLX phosphorylation on an evolutionarily conserved motif is necessary for the heterotetramer formation on the ChoRE and the transcriptional activity of the ChREBP-MLX complex. We identified casein kinase 2 (CK2) and glycogen synthase kinase 3 (GSK3) as MLX kinases. High intracellular glucose-6-phosphate accumulation inhibits MLX phosphorylation and heterotetramer formation on the ChoRE, impairing ChREBP-MLX activity. Physiologically, MLX phosphorylation is necessary in  Drosophila  to maintain sugar tolerance and lipid homeostasis. Our findings suggest that MLX phosphorylation is a key mechanism for the ChREBP-MLX heterotetramer formation to regulate carbohydrate and lipid metabolism.","MLX phosphorylation was studied for its role in ChREBP-MLX heterotetramer formation. This phosphorylation is essential for the heterotetramer to bind DNA and regulate metabolism, and its inhibition impairs sugar tolerance and lipid homeostasis.",2026-07-20T16:49:15Z,54009cf31e0f5e6b8c1bc3a3fdf4d416bc6f29c7a5424b302256c6eefd556b7d,"paperclip, version 0.6.2","paperclip search -s pmc ""MLX TCR inhibition"" -n 10"
MLX,MLX TCR inhibition,4,PMC4209802,,TCR-engineered T cells: A model of inducible TCR expression to dissect the interrelationship between two TCRs,"Simone Reuß, Zsolt Sebestyén, Niels Heinz, Rainer Loew, Christopher Baum, Reno Debets, Wolfgang Ucke...",2014,European Journal of Immunology,10.1002/eji.201343591,PMC4209802,24114521,https://doi.org/10.1002/eji.201343591,research-article,True,True,source_heuristic(/papers=full-text),"TCR gene modified T cells for adoptive therapy simultaneously express the Tg TCR and the endogenous TCR, which might lead to mispaired TCRs with harmful unknown specificity and to a reduced function of TCR-Tg T cells. We generated dual TCR T cells in two settings in which either TCR was constitutively expressed by a retroviral promoter while the second TCR expression was regulable by a Tet-on system. Constitutively expressed TCR molecules were reduced on the cell surface depending on the induced TCR expression leading to strongly hampered function. Besides that, using fluorescence resonance energy transfer we detected mispaired TCR dimers and different pairing behaviors of individual TCR chains with a mutual influence on TCR chain expression. The loss of function and mispairing could not be avoided by changing the TCR expression level or by introduction of an additional cysteine bridge. However, in polyclonal T cells, optimized TCR formats (cysteineization, codon optimization) enhanced correct pairing and function. We conclude from our data that (i) the level of mispairing depends on the individual TCRs and is not reduced by increasing the level of one TCR, and (ii) modifications (cysteineization, codon optimization) improve correct pairing but do not completely exclude mispairing (cysteineization).","Dual TCR T cells were engineered with one inducible TCR to study TCR mispairing and function. Inducible TCR expression reduced surface TCRs and hampered function, with mispaired TCRs detected despite modifications.",2026-07-20T16:49:15Z,9872160d8c25bd67ce6b8b8512085a424a72a63c86778471c47e9dd1e49aaed9,"paperclip, version 0.6.2","paperclip search -s pmc ""MLX TCR inhibition"" -n 10"
MLX,MLX TCR inhibition,5,PMC11425880,,Body‐Wide Inactivation of the Myc‐Like Mlx Transcription Factor Network Accelerates Aging and Increases the Lifetime Cancer Incidence,"Huabo Wang, Taylor Stevens, Jie Lu, Alexander Roberts, Clinton Van't Land, Radhika Muzumdar, Zhenwei...",2024,Advanced Science,10.1002/advs.202401593,PMC11425880,38976573,https://www.ncbi.nlm.nih.gov/pmc/articles/PMC11425880/,research-article,True,True,source_heuristic(/papers=full-text),"The “Mlx” and “Myc” transcription factor networks cross‐communicate and share many common gene targets. Myc's activity depends upon its heterodimerization with Max, whereas the Mlx Network requires that the Max‐like factor Mlx associate with the Myc‐like factors MondoA or ChREBP. The current work demonstrates that body‐wide  Mlx  inactivation, like that of  Myc , accelerates numerous aging‐related phenotypes pertaining to body habitus and metabolism. The deregulation of numerous aging‐related Myc target gene sets is also accelerated. Among other functions, these gene sets often regulate ribosomal and mitochondrial structure and function, genomic stability, and aging. Whereas “ Myc KO” mice have an extended lifespan because of a lower cancer incidence, “ Mlx KO” mice have normal lifespans and a higher cancer incidence. Like Myc, the expression of Mlx, MondoA, and ChREBP and their control over their target genes deteriorate with age in both mice and humans. Collectively, these findings underscore the importance of lifelong and balanced cross‐talk between the two networks to maintain proper function and regulation of the many factors that can affect normal aging.","Body-wide inactivation of the Mlx transcription factor network was studied. This inactivation accelerates aging phenotypes and increases lifetime cancer incidence, similar to Myc inactivation.",2026-07-20T16:49:15Z,b10876b7ee6ef94dd8b544d7f36b2e03ea8f46f0e02300dafe616a6d2280b3c3,"paperclip, version 0.6.2","paperclip search -s pmc ""MLX TCR inhibition"" -n 10"
MLX,MLX TCR inhibition,6,PMC8704919,,TCR signal strength defines distinct mechanisms of T cell dysfunction and cancer evasion,"Mojdeh Shakiba, Paul Zumbo, Gabriel Espinosa-Carrasco, Laura Menocal, Friederike Dündar, Sandra E. C...",2022,The Journal of Experimental Medicine,10.1084/jem.20201966,PMC8704919,34935874,https://doi.org/10.1084/jem.20201966,research-article,True,True,source_heuristic(/papers=full-text),"TCR signal strength determines T cell differentiation and function in tumors, with high-signal-strength interactions resulting in dysfunction and low-signal-strength interactions resulting in functional inertness. Fine-tuning TCR signal strength to an intermediate range improves anti-tumor activity in vivo.","High TCR signal strength leads to T cell dysfunction, while low strength causes inertness in tumors. Intermediate signal strength enhances anti-tumor activity.",2026-07-20T16:49:15Z,488c7e939fd6d63f8f825e4d79f1de898919c51ab7d935352d32e683ba07b271,"paperclip, version 0.6.2","paperclip search -s pmc ""MLX TCR inhibition"" -n 10"
MLX,MLX TCR inhibition,7,PMC10970504,,Domestication Gene  Mlx  and Its Partner  Mondo  Are Involved in Controlling the Larval Body Size and Cocoon Shell Weight of  Bombyx mori,"Xiaoxuan Qin, Liang Jiang, Ping Zhao, Ying Lin, Yi Zhang, Qingyou Xia",2024,International Journal of Molecular Sciences,10.3390/ijms25063427,PMC10970504,38542400,https://www.ncbi.nlm.nih.gov/pmc/articles/PMC10970504/,research-article,True,True,source_heuristic(/papers=full-text),"Bombyx mori  was domesticated from  Bombyx mandarina . The long-term domestication of the silkworm has brought about many remarkable changes to its body size and cocoon shell weight. However, the molecular mechanism underlying the improvement in the economic characteristics of this species during domestication remains unclear. In this study, we found that a transposable element (TE)—Bm1—was present in the upstream regulatory region of the  Mlx  (Max-like protein X) gene in wild silkworms but not in all domesticated silkworms. The absence of Bm1 caused an increase in the promoter activity and mRNA content of  Mlx . Mlx and its partner Mondo belong to the bHLHZ transcription factors family and regulate nutrient metabolism. RNAi of  Mlx  and  Mondo  decreased the expression and promoter activity of glucose metabolism-related genes ( trehalose transport  ( Tret ),  phosphofructokinase  ( PFK ), and  pyruvate kinase  ( PK )), lipogenic genes ( Acetyl-CoA carboxylase  ( ACC ) and  fatty acid synthase  ( FAS )), and glutamine synthesis gene ( Glutamine synthase 2,  ( GS2 )). Furthermore, the transgenic overexpression of  Mlx  and  Mondo  in the fat body of silkworms increased the larval body size, cocoon shell weight, and egg number, but the silencing of the two genes resulted in the opposite phenotypes. Our results reveal the molecular mechanism of  Mlx  selection during domestication and its successful use in the molecular breeding of  Bombyx mori .","The study investigated the role of the domestication gene *Mlx* and its partner *Mondo* in *Bombyx mori*. Their altered expression, influenced by a transposable element, controls larval body size and cocoon shell weight by regulating nutrient metabolism.",2026-07-20T16:49:15Z,c2ea9b459a54b85e7c2e528b4eb10ec960cf026be1b58ff1c255dbd5ab91d96c,"paperclip, version 0.6.2","paperclip search -s pmc ""MLX TCR inhibition"" -n 10"
MLX,MLX TCR inhibition,8,PMC5587706,,A TCR-based Chimeric Antigen Receptor,"Even Walseng, Hakan Köksal, Ibrahim M. Sektioglu, Anne Fåne, Gjertrud Skorstad, Gunnar Kvalheim, Gus...",2017,Scientific Reports,10.1038/s41598-017-11126-y,PMC5587706,28878363,https://doi.org/10.1038/s41598-017-11126-y,research-article,True,True,source_heuristic(/papers=full-text),"Effector T cells equipped with engineered antigen receptors specific for cancer targets have proven to be very efficient. Two methods have emerged: the Chimeric Antigen Receptors (CARs) and T-cell Receptor (TCR) redirection. Although very potent, CAR recognition is limited to membrane antigens which represent around 1% of the total proteins expressed, whereas TCRs have the advantage of targeting any peptide resulting from cellular protein degradation. However, TCRs depend on heavy signalling machinery only present in T cells which restricts the type of eligible therapeutic cells. Hence, an introduced therapeutic TCR will compete with the endogenous TCR for the signalling proteins and carries the potential risk of mixed dimer formation giving rise to a new TCR with unpredictable specificity. We have fused a soluble TCR construct to a CAR-signalling tail and named the final product TCR-CAR. We here show that, if expressed, the TCR-CAR conserved the specificity and the functionality of the original TCR. In addition, we demonstrate that TCR-CAR redirection was not restricted to T cells. Indeed, after transduction, the NK cell line NK-92 became TCR positive and reacted against pMHC target. This opens therapeutic avenues combing the killing efficiency of NK cells with the diversified target recognition of TCRs.","A novel TCR-CAR construct was developed by fusing a soluble TCR to a CAR signaling domain. This TCR-CAR successfully redirected NK cells to recognize specific targets, combining NK cell killing efficiency with TCR-based antigen recognition.",2026-07-20T16:49:15Z,2e2689662dab4a92ec09b8be911cff2e348eb6184371efddd1b1df292e17ec89,"paperclip, version 0.6.2","paperclip search -s pmc ""MLX TCR inhibition"" -n 10"
MLX,MLX TCR inhibition,9,PMC11237943,,A novel gain-of-function phosphorylation site modulates PTPN22 inhibition of TCR signaling,"Chuling Zhuang, Shen Yang, Carlos G. Gonzalez, Richard I. Ainsworth, Sheng Li, Masumi Takayama Kobay...",2024,The Journal of Biological Chemistry,10.1016/j.jbc.2024.107393,PMC11237943,38777143,https://doi.org/10.1016/j.jbc.2024.107393,research-article,True,False,source_heuristic(/papers=full-text),"Protein tyrosine phosphatase nonreceptor type 22 (PTPN22) is encoded by a major autoimmunity gene and is a known inhibitor of T cell receptor (TCR) signaling and drug target for cancer immunotherapy. However, little is known about PTPN22 posttranslational regulation. Here, we characterize a phosphorylation site at Ser 325  situated C terminal to the catalytic domain of PTPN22 and its roles in altering protein function. In human T cells, Ser 325  is phosphorylated by glycogen synthase kinase-3 (GSK3) following TCR stimulation, which promotes its TCR-inhibitory activity. Signaling through the major TCR-dependent pathway under PTPN22 control was enhanced by CRISPR/Cas9-mediated suppression of Ser 325  phosphorylation and inhibited by mimicking it  via  glutamic acid substitution. Global phospho-mass spectrometry showed Ser 325  phosphorylation state alters downstream transcriptional activity through enrichment of Swi3p, Rsc8p, and Moira domain binding proteins, and next-generation sequencing revealed it differentially regulates the expression of chemokines and T cell activation pathways. Moreover,  in vitro  kinetic data suggest the modulation of activity depends on a cellular context. Finally, we begin to address the structural and mechanistic basis for the influence of Ser 325  phosphorylation on the protein’s properties by deuterium exchange mass spectrometry and NMR spectroscopy. In conclusion, this study explores the function of a novel phosphorylation site of PTPN22 that is involved in complex regulation of TCR signaling and provides details that might inform the future development of allosteric modulators of PTPN22.","A novel phosphorylation site (Ser 325) on PTPN22 was identified and characterized. This site enhances PTPN22's inhibitory effect on TCR signaling, potentially influencing autoimmune diseases and cancer immunotherapy.",2026-07-20T16:49:15Z,ef2b0971d60bede09b7647342f727212b14aa9cf139297173a4810e66570b283,"paperclip, version 0.6.2","paperclip search -s pmc ""MLX TCR inhibition"" -n 10"
MLX,MLX TCR inhibition,10,PMC6504948,,Synthetic TRuC receptors engaging the complete T cell receptor for potent anti-tumor response,"Patrick A. Baeuerle, Jian Ding, Ekta Patel, Niko Thorausch, Holly Horton, Jessica Gierut, Irene Scar...",2019,Nature Communications,10.1038/s41467-019-10097-0,PMC6504948,31064990,https://doi.org/10.1038/s41467-019-10097-0,research-article,True,True,source_heuristic(/papers=full-text),"T cells expressing CD19-targeting chimeric antigen receptors (CARs) reveal high efficacy in the treatment of B cell malignancies. Here, we report that T cell receptor fusion constructs (TRuCs) comprising an antibody-based binding domain fused to T cell receptor (TCR) subunits can effectively reprogram an intact TCR complex to recognize tumor surface antigens. Unlike CARs, TRuCs become a functional component of the TCR complex. TRuC-T cells kill tumor cells as potently as second-generation CAR-T cells, but at significant lower cytokine release and despite the absence of an extra co-stimulatory domain. TRuC-T cells demonstrate potent anti-tumor activity in both liquid and solid tumor xenograft models. In several models, TRuC-T cells are more efficacious than respective CAR-T cells. TRuC-T cells are shown to engage the signaling capacity of the entire TCR complex in an HLA-independent manner.","Synthetic TRuC receptors were engineered to engage the complete T cell receptor complex for tumor antigen recognition. TRuC-T cells exhibit potent anti-tumor activity, comparable to CAR-T cells but with reduced cytokine release and HLA-independent function.",2026-07-20T16:49:15Z,6cfdd34c81905fbe5dd989bf9531a64c473e80b1c95ec29a3c5e2f3bc1572895,"paperclip, version 0.6.2","paperclip search -s pmc ""MLX TCR inhibition"" -n 10"
