TF,exact_query,retrieval_rank,result_id,relevance_score,title,authors,year,journal,doi,pmcid,other_source_id,source_url,publication_type,abstract_available,full_text_available,full_text_available_method,abstract,snippet,retrieval_timestamp_utc,raw_response_sha256,paperclip_version,paperclip_command
GTF2A2,GTF2A2 TCR inhibition,3,PMC12346228,,Exploiting TCR Repertoire Analysis to Select Therapeutic TCRs for Cancer Immunotherapy,"Ursule M. Demaël, Thunchanok Rirkkrai, Fatma Zehra Okus, Andreas Tiffeau-Mayer, Hans J. Stauss",2025,Cells,10.3390/cells14151223,PMC12346228,40801654,https://www.ncbi.nlm.nih.gov/pmc/articles/PMC12346228/,review-article,True,True,source_heuristic(/papers=full-text),"Over the past decade, numerous innovative immunotherapy strategies have transformed the treatment of cancer and improved the survival of patients unresponsive to conventional chemotherapy and radiation therapy. Immune checkpoint inhibition approaches aim to block negative regulatory pathways that limit the function of endogenous T cells, while adoptive cell therapy produces therapeutic T cells with high functionality and defined cancer specificity. While CAR engineering successfully targets cancer surface antigens, TCR engineering enables targeting of the entire cancer proteome, including mutated neo-antigens. To date, TCR engineering strategies have focused on the identification of target cancer antigens recognised by well-characterised therapeutic TCRs. In this review, we explore whether antigen-focused approaches could be complemented by TCR-focused approaches, whereby information of the TCR repertoire of individual patients provides the basis for selecting TCRs to engineer autologous T cells for adoptive cell therapy. We discuss how TCR clonality profiles, distribution in T cell subsets, and bioinformatic screening against continuously improving TCR databases can guide the selection of TCRs for therapeutic application. We further outline in vitro approaches to prioritise TCR candidates to confirm cancer reactivity and exclude recognition of healthy autologous cells, which could provide validation for their therapeutic use even when the target antigen remains unknown.",This review explores using individual patient TCR repertoire data to select T cells for adoptive cancer immunotherapy. Such TCR-focused approaches could complement antigen-focused strategies by identifying functional TCRs even when the target antigen is unknown.,2026-07-20T16:48:19Z,ba00994753d57c1ddb2974e1e7bd4944c1ccd9c546523991180552ffe0dfe12a,"paperclip, version 0.6.2","paperclip search -s pmc ""GTF2A2 TCR inhibition"" -n 10"
GTF2A2,GTF2A2 TCR inhibition,4,PMC4209802,,TCR-engineered T cells: A model of inducible TCR expression to dissect the interrelationship between two TCRs,"Simone Reuß, Zsolt Sebestyén, Niels Heinz, Rainer Loew, Christopher Baum, Reno Debets, Wolfgang Ucke...",2014,European Journal of Immunology,10.1002/eji.201343591,PMC4209802,24114521,https://doi.org/10.1002/eji.201343591,research-article,True,True,source_heuristic(/papers=full-text),"TCR gene modified T cells for adoptive therapy simultaneously express the Tg TCR and the endogenous TCR, which might lead to mispaired TCRs with harmful unknown specificity and to a reduced function of TCR-Tg T cells. We generated dual TCR T cells in two settings in which either TCR was constitutively expressed by a retroviral promoter while the second TCR expression was regulable by a Tet-on system. Constitutively expressed TCR molecules were reduced on the cell surface depending on the induced TCR expression leading to strongly hampered function. Besides that, using fluorescence resonance energy transfer we detected mispaired TCR dimers and different pairing behaviors of individual TCR chains with a mutual influence on TCR chain expression. The loss of function and mispairing could not be avoided by changing the TCR expression level or by introduction of an additional cysteine bridge. However, in polyclonal T cells, optimized TCR formats (cysteineization, codon optimization) enhanced correct pairing and function. We conclude from our data that (i) the level of mispairing depends on the individual TCRs and is not reduced by increasing the level of one TCR, and (ii) modifications (cysteineization, codon optimization) improve correct pairing but do not completely exclude mispairing (cysteineization).","Dual TCR T cells were engineered with one inducible TCR to study TCR mispairing and function. Inducible TCR expression reduced surface TCRs and hampered function, with mispaired TCRs detected despite modifications.",2026-07-20T16:48:19Z,9872160d8c25bd67ce6b8b8512085a424a72a63c86778471c47e9dd1e49aaed9,"paperclip, version 0.6.2","paperclip search -s pmc ""GTF2A2 TCR inhibition"" -n 10"
GTF2A2,GTF2A2 TCR inhibition,5,PMC11014665,,An EBV-related CD4 TCR immunotherapy inhibits tumor growth in an HLA-DP5 +  nasopharyngeal cancer mouse model,"Chenwei Wang, Jiewen Chen, Jingyao Li, Zhihong Xu, Lihong Huang, Qian Zhao, Lei Chen, Xiaolong Liang...",2024,The Journal of Clinical Investigation,10.1172/JCI172092,PMC11014665,38412034,https://www.ncbi.nlm.nih.gov/pmc/articles/PMC11014665/,research-article,True,True,source_heuristic(/papers=full-text),"Adoptive transfer of T cell receptor–engineered T cells (TCR-T) is a promising strategy for immunotherapy against solid tumors. However, the potential of CD4 +  T cells in mediating tumor regression has been neglected. Nasopharyngeal cancer is consistently associated with EBV. Here, to evaluate the therapeutic potential of CD4 TCR-T in nasopharyngeal cancer, we screened for CD4 TCRs recognizing EBV nuclear antigen 1 (EBNA1) presented by HLA-DP5. Using mass spectrometry, we identified EBNA1 567–581 , a peptide naturally processed and presented by HLA-DP5. We isolated TCR135, a CD4 TCR with high functional avidity, that can function in both CD4 +  and CD8 +  T cells and recognizes HLA-DP5–restricted EBNA1 567–581 . TCR135-transduced T cells functioned in two ways: directly killing HLA-DP5 + EBNA1 +  tumor cells after recognizing EBNA1 presented by tumor cells and indirectly killing HLA-DP5–negative tumor cells after recognizing EBNA1 presented by antigen-presenting cells. TCR135-transduced T cells preferentially infiltrated into the tumor microenvironment and significantly inhibited tumor growth in xenograft nasopharyngeal tumor models. Additionally, we found that 62% of nasopharyngeal cancer patients showed 50%–100% expression of HLA-DP on tumor cells, indicating that nasopharyngeal cancer is well suited for CD4 TCR-T therapy. These findings suggest that TCR135 may provide a new strategy for EBV-related nasopharyngeal cancer immunotherapy in HLA-DP5 +  patients.","CD4 TCR-engineered T cells targeting EBV antigen EBNA1 presented by HLA-DP5 were developed. These T cells significantly inhibited nasopharyngeal cancer growth in mouse models, suggesting therapeutic potential for HLA-DP5+ patients.",2026-07-20T16:48:19Z,8e6f2bea172ade3f2fdef67698f8f9a5e32ed30ef9bbf3047c7c340bfdd4aad3,"paperclip, version 0.6.2","paperclip search -s pmc ""GTF2A2 TCR inhibition"" -n 10"
GTF2A2,GTF2A2 TCR inhibition,6,PMC12934713,,A universal platform for simultaneous TCRα/β removal enables safer and more potent TCR therapies and autoimmune modeling,Giorgia Zanetti; Mateusz Legut; Austin Chen; Farshid Fathi; Nathan Suek; Nato Teteloshvili; Hao Wei ...,,bioRxiv,10.64898/2026.02.19.706929,PMC12934713,41756994,https://doi.org/10.64898/2026.02.19.706929,Article,True,True,source_heuristic(/papers=full-text),"Adoptive T-cell therapies using tumour-specific T-cell receptors (TCRs) are limited by competition with endogenous receptors, which impairs efficacy and poses risks of off-target autoreactivity. Here we present a CRISPR-based platform that completely and selectively eliminates both endogenous TCR-α and -β chains without affecting introduced transgenic TCRs, irrespective of codon optimization. This approach achieves >90% deletion efficiency in Jurkat and primary human T cells, markedly enhancing the expression, pairing fidelity, and functional potency of transgenic receptors. Using a clinically relevant HLA-A*02:01-restricted DMF5 TCR, we show that dual TCR ablation boosts antigen-specific activation and cytotoxicity in vitro and significantly enhances tumor clearance in vivo in human immune system (HIS) mice, while preventing graft-versus-host disease (GVHD). Targeted locus amplification revealed that CRISPR-induced double-strand breaks did not alter lentiviral integration profiles, confirming genomic safety. Extending this approach to four insulin-reactive TCRs demonstrated that removal of endogenous receptors increased transduction efficiency and functional activity, with one (1E6) showing selective activation and infiltration of stem cell–derived islet grafts (SC-islets) in vivo. This study establishes a universal, safe, and scalable genome-editing platform for generating functionally precise human T cells. By integrating cancer immunotherapy and autoimmune disease modelling within a single framework, it provides a strong preclinical rationale for dual endogenous TCR removal as a route to improved specificity, safety, and therapeutic efficacy in TCR-based cell therapies.","This study presents a CRISPR-based platform for removing endogenous TCR-α and -β chains. This dual ablation enhances transgenic TCR expression and potency, improving tumor clearance and preventing GVHD in preclinical models. The platform also aids in modeling autoimmune diseases by increasing the activity of insulin-reactive TCRs.",2026-07-20T16:48:19Z,27b9150a3f24b37c44d3aa55c43de4863a29dcd493cd62902960a8e746bb5929,"paperclip, version 0.6.2","paperclip search -s pmc ""GTF2A2 TCR inhibition"" -n 10"
GTF2A2,GTF2A2 TCR inhibition,7,PMC12261488,,TCR-epiDiff: solving dual challenges of TCR generation and binding prediction,"Se Yeon Seo, Je-Keun Rhee",2025,Bioinformatics,10.1093/bioinformatics/btaf202,PMC12261488,40662810,https://www.ncbi.nlm.nih.gov/pmc/articles/PMC12261488/,research-article,True,True,source_heuristic(/papers=full-text),"T cell receptors (TCRs) are fundamental components of the adaptive immune system, recognizing specific antigens for targeted immune responses. Understanding their sequence patterns is crucial for designing effective vaccines and immunotherapies. However, the vast diversity of TCR sequences and complex binding mechanisms pose significant challenges in generating TCRs that are specific to a particular epitope. Here, we propose TCR-epiDiff, a diffusion-based deep learning model for generating epitope-specific TCRs and predicting TCR–epitope binding. TCR-epiDiff integrates epitope information during TCR sequence embedding using ProtT5-XL and employs a denoising diffusion probabilistic model for sequence generation. Using external validation datasets, we demonstrate the ability to generate biologically plausible, epitope-specific TCRs. Furthermore, we leverage the model’s encoder to develop a TCR–epitope binding predictor that shows robust performance on the external validation data. Our approach provides a comprehensive solution for both  de novo  generation of epitope-specific TCRs and TCR–epitope binding prediction. This capability provides valuable insights into immune diversity and has the potential to advance targeted immunotherapies. The data and source codes for our experiments are available at:  https://github.com/seoseyeon/TCR-epiDiff .","A diffusion-based model, TCR-epiDiff, was developed to generate epitope-specific T cell receptors (TCRs) and predict TCR-epitope binding. The model successfully generates biologically plausible TCRs and accurately predicts binding affinity, offering a comprehensive solution for TCR design and immunotherapy.",2026-07-20T16:48:19Z,e306ecec769efec35a6b937270f0b2d49bd7d7495f63ea3d1bf6db9e6bab1a64,"paperclip, version 0.6.2","paperclip search -s pmc ""GTF2A2 TCR inhibition"" -n 10"
GTF2A2,GTF2A2 TCR inhibition,8,PMC10287668,,Antibody-based binding domain fused to TCRγ chain facilitates T cell cytotoxicity for potent anti-tumor response,"Zhao Chen, Changyou Lin, Hong Pei, Xiaomei Yuan, Jia Xu, Mingwei Zou, Xinyuan Zhang, Amber Fossier, ...",2023,Oncogenesis,10.1038/s41389-023-00480-4,PMC10287668,37349298,https://doi.org/10.1038/s41389-023-00480-4,research-article,True,True,source_heuristic(/papers=full-text),"Chimeric antigen receptor T-cell (CAR-T) therapy has demonstrated potent clinical efficacy in the treatment of hematopoietic malignancies. However, the application of CAR-T in solid tumors has been limited due in part to the expression of inhibitory molecules in the tumor microenvironment, leading to T-cell exhaustion. To overcome this limitation, we have developed a synthetic T-cell receptor (TCR) that targets programmed death-ligand 1 (PD-L1), a molecule that is widely expressed in various solid tumors and plays a pivotal role in T-cell exhaustion. Our novel TCR platform is based on antibody-based binding domain, which is typically a single-chain variable fragment (scFv), fused to the γδ TCRs (TCRγδ). We have utilized the T-cell receptor alpha constant (TRAC) locus editing approach to express cell surface scFv of anti-PD-L1, which is fused to the constant region of the TCRγ or TCRδ chain in activated T cells derived from peripheral blood mononuclear cells (PBMCs). Our results indicate that these reconfigured receptors, both γ-TCRγδ and δ-TCRγδ, have the capability to transduce signals, produce inflammatory cytokines, degranulate and exert tumor killing activity upon engagement with PD-L1 antigen in vitro. Additionally, we have also shown that γ-TCRγδ exerted superior efficacy than δ-TCRγδ in in vivo xenograft model.","A novel synthetic T-cell receptor targeting PD-L1 was developed by fusing an antibody-based binding domain to the TCRγ chain. This engineered T-cell receptor enhances T-cell cytotoxicity against solid tumors, with the γ-TCRγδ variant showing superior efficacy.",2026-07-20T16:48:19Z,f16aa9e079cb078245485d492d991626757238e2b8743ec84ae4952478e997ff,"paperclip, version 0.6.2","paperclip search -s pmc ""GTF2A2 TCR inhibition"" -n 10"
GTF2A2,GTF2A2 TCR inhibition,9,PMC11302870,,Inhibition of PCSK9 enhances the anti-hepatocellular carcinoma effects of TCR-T cells and anti-PD-1 immunotherapy,"Weikang Xu, Minli Hu, Xinyu Lu, Yueqiong Lao, Na Ma, Yiyue Wang, Jing Li, Xingyuan Chen, Shiming Liu...",2024,International Journal of Biological Sciences,10.7150/ijbs.93668,PMC11302870,39113701,https://www.ncbi.nlm.nih.gov/pmc/articles/PMC11302870/,research-article,True,True,source_heuristic(/papers=full-text),"T cells play important roles in antitumor immunity. However, given that the hepatocellular carcinoma (HCC) tumor microenvironment confers resistance to T cell-based immunotherapies, novel strategies to boost T cell-mediated antitumor efficacy are urgently needed for the treatment of HCC. Here, we show that high proprotein convertase subtilisin/kexin type9 (PCSK9) expression was negatively associated with HCC patient's overall survival and markers of CD8 +  T cells. Pharmacological inhibition of PCSK9 enhanced tumor-specific killing and downregulated PD-1 expression of AFP-specific TCR-T. Inhibition of PCSK9 significantly enhances the anti-HCC efficacy of TCR-T cells and anti-PD-1 immunotherapy  in vivo . Moreover, PCSK9 inhibitor suppressed HCC growth dependent on CD8 +  T cells. Mechanically, pharmacological inhibition of PCSK9 promoted low-density lipoprotein receptor (LDLR)-mediated activation of mTORC1 signaling in CD8 +  T cells. LDLR deficiency was shown to impair cellular mTORC1 signaling and the anti-HCC function of CD8 T cells. On the basis of our findings in this study, we propose a potential metabolic intervention strategy that could be used to enhance the antitumor effects of immunotherapy for HCC.",This study investigated the role of PCSK9 in hepatocellular carcinoma (HCC) and its impact on T cell-based immunotherapies. Inhibiting PCSK9 enhances the effectiveness of TCR-T cells and anti-PD-1 immunotherapy against HCC by promoting CD8+ T cell function.,2026-07-20T16:48:19Z,51d16b8af871864dc6cc5c43ab626715e0a8bbae5d9ae70676cc8df57d70af15,"paperclip, version 0.6.2","paperclip search -s pmc ""GTF2A2 TCR inhibition"" -n 10"
GTF2A2,GTF2A2 TCR inhibition,10,PMC6670834,,A Dual Inhibitor of Cdc7/Cdk9 Potently Suppresses T Cell Activation,"Elijah W. Chen, Neil Q. Tay, Joanna Brzostek, Nicholas R. J. Gascoigne, Vasily Rybakin",2019,Frontiers in Immunology,10.3389/fimmu.2019.01718,PMC6670834,31402912,https://www.ncbi.nlm.nih.gov/pmc/articles/PMC6670834/,research-article,True,True,source_heuristic(/papers=full-text),"T cell activation is mediated by signaling pathways originating from the T cell receptor (TCR). Propagation of signals downstream of the TCR involves a cascade of numerous kinases, some of which have yet to be identified. Through a screening strategy that we have previously introduced, PHA-767491, an inhibitor of the kinases Cdc7 and Cdk9, was identified to impede TCR signaling. PHA-767491 suppressed several T cell activation phenomena, including the expression of activation markers, proliferation, and effector functions. We also observed a defect in TCR signaling pathways upon PHA-767491 treatment. Inhibition of Cdc7/Cdk9 impairs T cell responses, which could potentially be detrimental for the immune response to tumors, and also compromises the ability to resist infections. The Cdc7/Cdk9 inhibitor is a strong candidate as a cancer therapeutic, but its effect on the immune system poses a problem for clinical applications.","A dual inhibitor of Cdc7/Cdk9, PHA-767491, was found to impede T cell receptor signaling. This inhibition suppressed T cell activation, proliferation, and effector functions, suggesting potential therapeutic applications but also immune system risks.",2026-07-20T16:48:19Z,c937d776b5b974ffaea8c8e8c46ee73517dbdaedac3ed14243d65ff1d7bb07e4,"paperclip, version 0.6.2","paperclip search -s pmc ""GTF2A2 TCR inhibition"" -n 10"
GTF3C2,GTF3C2 TCR inhibition,1,PMC12078175,,GTF3C2 Promotes the Proliferation of Hepatocellular Carcinoma Cells through the USP21/MEK2/ERK1/2 Pathway,"Yani Wu, Yingnan Yang, Youju Zhang, Qiuran Xu, Dongsheng Huang, Kangsheng Tu",2025,Journal of Clinical and Translational Hepatology,10.14218/JCTH.2024.00386,PMC12078175,40385937,https://www.ncbi.nlm.nih.gov/pmc/articles/PMC12078175/,research-article,True,True,source_heuristic(/papers=full-text),"General transcription factor IIIC subunit 2 (GTF3C2) is one of the polymerase III transcription-related factors. Previous studies have revealed that GTF3C2 is involved in regulating cell proliferation. However, the role of GTF3C2 in hepatocellular carcinoma (HCC) remains unclear. This study aimed to determine its expression, biological function, and mechanism in HCC. The expression of GTF3C2 in HCC and non-tumor tissues, along with its clinical significance, was investigated using public databases and clinical samples. Reverse transcription-quantitative polymerase chain reaction and Western blot assays were performed to detect the expression of GTF3C2, ubiquitin specific peptidase 21 (USP21), mitogen-activated protein kinase 2 (MEK2), extracellular signal-regulated kinase 1/2 (ERK1/2), and p-ERK1/2 in cells. A luciferase reporter assay was conducted to explore the regulatory effect of GTF3C2 on USP21 transcription. Cell Counting Kit-8, 5-ethynyl-2′-deoxyuridine, and colony formation assays were performed to assess HCC cell proliferation. Subcutaneous injection of HCC cells into nude mice was used to evaluate tumor growth  in vivo . GTF3C2 expression was upregulated in HCC tissues and was positively correlated with advanced tumor stages and high tumor grades. HCC patients with high GTF3C2 expression had significantly worse survival outcomes. Knockdown of GTF3C2 suppressed the proliferation of Hep3B and HCCLM3 cells, while overexpression of GTF3C2 facilitated the proliferation of SNU449 and Huh7 cells. GTF3C2 promoted USP21 expression by activating its transcription, which subsequently increased the levels of MEK2 and p-ERK1/2 in HCC cells. Overexpression of both USP21 and MEK2 counteracted the GTF3C2 knockdown-induced inactivation of the ERK1/2 pathway. Moreover, GTF3C2 promoted HCC cell proliferation  in vitro  and tumor growth  in vivo  by regulating the USP21/MEK2/ERK1/2 pathway. Upregulation of GTF3C2 is frequently observed in HCC tissues and predicts poor prognosis. GTF3C2 promotes HCC cell proliferation via the USP21/MEK2/ERK1/2 pathway.",GTF3C2 expression was studied in hepatocellular carcinoma (HCC) and found to be upregulated. This upregulation promotes HCC cell proliferation by activating the USP21/MEK2/ERK1/2 pathway.,2026-07-20T16:48:22Z,fe222245b2ca65b5f9dc50d7d8272d115ea524c758527a01ff677cc5c1ead254,"paperclip, version 0.6.2","paperclip search -s pmc ""GTF3C2 TCR inhibition"" -n 10"
GTF3C2,GTF3C2 TCR inhibition,2,PMC4209802,,TCR-engineered T cells: A model of inducible TCR expression to dissect the interrelationship between two TCRs,"Simone Reuß, Zsolt Sebestyén, Niels Heinz, Rainer Loew, Christopher Baum, Reno Debets, Wolfgang Ucke...",2014,European Journal of Immunology,10.1002/eji.201343591,PMC4209802,24114521,https://doi.org/10.1002/eji.201343591,research-article,True,True,source_heuristic(/papers=full-text),"TCR gene modified T cells for adoptive therapy simultaneously express the Tg TCR and the endogenous TCR, which might lead to mispaired TCRs with harmful unknown specificity and to a reduced function of TCR-Tg T cells. We generated dual TCR T cells in two settings in which either TCR was constitutively expressed by a retroviral promoter while the second TCR expression was regulable by a Tet-on system. Constitutively expressed TCR molecules were reduced on the cell surface depending on the induced TCR expression leading to strongly hampered function. Besides that, using fluorescence resonance energy transfer we detected mispaired TCR dimers and different pairing behaviors of individual TCR chains with a mutual influence on TCR chain expression. The loss of function and mispairing could not be avoided by changing the TCR expression level or by introduction of an additional cysteine bridge. However, in polyclonal T cells, optimized TCR formats (cysteineization, codon optimization) enhanced correct pairing and function. We conclude from our data that (i) the level of mispairing depends on the individual TCRs and is not reduced by increasing the level of one TCR, and (ii) modifications (cysteineization, codon optimization) improve correct pairing but do not completely exclude mispairing (cysteineization).","Dual TCR T cells were engineered with one inducible TCR to study TCR mispairing and function. Inducible TCR expression reduced surface TCRs and hampered function, with mispaired TCRs detected despite modifications.",2026-07-20T16:48:22Z,9872160d8c25bd67ce6b8b8512085a424a72a63c86778471c47e9dd1e49aaed9,"paperclip, version 0.6.2","paperclip search -s pmc ""GTF3C2 TCR inhibition"" -n 10"
GTF3C2,GTF3C2 TCR inhibition,3,PMC11237943,,A novel gain-of-function phosphorylation site modulates PTPN22 inhibition of TCR signaling,"Chuling Zhuang, Shen Yang, Carlos G. Gonzalez, Richard I. Ainsworth, Sheng Li, Masumi Takayama Kobay...",2024,The Journal of Biological Chemistry,10.1016/j.jbc.2024.107393,PMC11237943,38777143,https://doi.org/10.1016/j.jbc.2024.107393,research-article,True,False,source_heuristic(/papers=full-text),"Protein tyrosine phosphatase nonreceptor type 22 (PTPN22) is encoded by a major autoimmunity gene and is a known inhibitor of T cell receptor (TCR) signaling and drug target for cancer immunotherapy. However, little is known about PTPN22 posttranslational regulation. Here, we characterize a phosphorylation site at Ser 325  situated C terminal to the catalytic domain of PTPN22 and its roles in altering protein function. In human T cells, Ser 325  is phosphorylated by glycogen synthase kinase-3 (GSK3) following TCR stimulation, which promotes its TCR-inhibitory activity. Signaling through the major TCR-dependent pathway under PTPN22 control was enhanced by CRISPR/Cas9-mediated suppression of Ser 325  phosphorylation and inhibited by mimicking it  via  glutamic acid substitution. Global phospho-mass spectrometry showed Ser 325  phosphorylation state alters downstream transcriptional activity through enrichment of Swi3p, Rsc8p, and Moira domain binding proteins, and next-generation sequencing revealed it differentially regulates the expression of chemokines and T cell activation pathways. Moreover,  in vitro  kinetic data suggest the modulation of activity depends on a cellular context. Finally, we begin to address the structural and mechanistic basis for the influence of Ser 325  phosphorylation on the protein’s properties by deuterium exchange mass spectrometry and NMR spectroscopy. In conclusion, this study explores the function of a novel phosphorylation site of PTPN22 that is involved in complex regulation of TCR signaling and provides details that might inform the future development of allosteric modulators of PTPN22.","A novel phosphorylation site (Ser 325) on PTPN22 was identified and characterized. This site enhances PTPN22's inhibitory effect on TCR signaling, potentially influencing autoimmune diseases and cancer immunotherapy.",2026-07-20T16:48:22Z,ef2b0971d60bede09b7647342f727212b14aa9cf139297173a4810e66570b283,"paperclip, version 0.6.2","paperclip search -s pmc ""GTF3C2 TCR inhibition"" -n 10"
